title,link
"khám bệnh, phát thuốc miễn phí cho người cao tuổi",https://dantri.com.vn/tu-van/kham-benh-phat-thuoc-mien-phi-cho-nguoi-cao-tuoi-1400498126.htm
người cao tuổi 100 tuổi được chủ tịch nước chúc thọ và tặng quà,https://dantri.com.vn/xa-hoi/nguoi-cao-tuoi-100-tuoi-duoc-chu-tich-nuoc-chuc-tho-va-tang-qua-1298989283.htm
geego sure – món quà quý chăm sóc người cao tuổi,https://dantri.com.vn/tu-van/geego-sure-mon-qua-quy-cham-soc-nguoi-cao-tuoi-1356493587.htm
"khám chữa bệnh tại nhà, bảo vệ người cao tuổi trước dịch covid-19",https://dantri.com.vn/suc-khoe/kham-chua-benh-tai-nha-bao-ve-nguoi-cao-tuoi-truoc-dich-covid-19-20200812124800511.htm
cảnh báo nhiều ca tử vong do sặc thức ăn ở người cao tuổi,https://dantri.com.vn/suc-khoe/canh-bao-nhieu-ca-tu-vong-do-sac-thuc-an-o-nguoi-cao-tuoi-20200505120358006.htm
đến thăm vùng nguyên liệu làm nên sản phẩm nước giải khát made in việt nam đầu tiên dành cho người cao tuổi,https://dantri.com.vn/kinh-doanh/den-tham-vung-nguyen-lieu-lam-nen-san-pham-nuoc-giai-khat-made-in-viet-nam-dau-tien-danh-cho-nguoi-cao-tuoi-20200410135317319.htm
"nghệ an chi trên 13 tỷ đồng hỗ trợ người nghèo, mừng thọ người cao tuổi",https://dantri.com.vn/xa-hoi/nghe-an-chi-tren-13-ty-dong-ho-tro-nguoi-ngheo-mung-tho-nguoi-cao-tuoi-1359005899.htm
"nhật mở rộng ngành nghề lao động, ưu tiên công việc chăm sóc người cao tuổi",https://dantri.com.vn/lao-dong-viec-lam/nhat-mo-rong-nganh-nghe-lao-dong-uu-tien-cong-viec-cham-soc-nguoi-cao-tuoi-20220906170600560.htm
"người cao tuổi châu á muốn làm việc, tiếp tục đóng góp cho xã hội",https://dantri.com.vn/lao-dong-viec-lam/nguoi-cao-tuoi-chau-a-muon-lam-viec-tiep-tuc-dong-gop-cho-xa-hoi-20191001214248805.htm
cảm nhận của những người cao tuổi về tết trong quá khứ và hiện tại,https://dantri.com.vn/van-hoa/cam-nhan-cua-nhung-nguoi-cao-tuoi-ve-tet-trong-qua-khu-va-hien-tai-20210201112233231.htm
"người cao tuổi, mắc nhiều bệnh nền xúc động khi được tiêm vắc xin covid-19",https://dantri.com.vn/xa-hoi/nguoi-cao-tuoi-mac-nhieu-benh-nen-xuc-dong-khi-duoc-tiem-vac-xin-covid19-20210728184112603.htm
người cao tuổi nhất được cứu nhờ quyết định can thiệp tim mạch,https://dantri.com.vn/suc-khoe/nguoi-cao-tuoi-nhat-duoc-cuu-nho-quyet-dinh-can-thiep-tim-mach-20160509094512448.htm
những thực phẩm không có lợi cho sức khỏe người cao tuổi,https://dantri.com.vn/tu-van/nhung-thuc-pham-khong-co-loi-cho-suc-khoe-nguoi-cao-tuoi-1400380711.htm
sở vhttdl hải phòng cấp phép karaoke “tra tấn” người cao tuổi!,https://dantri.com.vn/van-hoa/so-vhttdl-hai-phong-cap-phep-karaoke-tra-tan-nguoi-cao-tuoi-20150914103515154.htm
"hà nội: người cao tuổi, có bệnh nền được ưu tiên tiêm vắc xin covid-19",https://dantri.com.vn/suc-khoe/ha-noi-nguoi-cao-tuoi-co-benh-nen-duoc-uu-tien-tiem-vac-xin-covid19-20210903151933028.htm
"thủ tướng: tiêm phòng ngay người cao tuổi, có bệnh nền, yêu cầu dân ""ở yên""",https://dantri.com.vn/xa-hoi/thu-tuong-tiem-phong-ngay-nguoi-cao-tuoi-co-benh-nen-yeu-cau-dan-o-yen-20210806082556267.htm
vinamilk sure prevent đồng hành cùng phong trào rèn luyện sức khoẻ người cao tuổi,https://dantri.com.vn/doi-song/vinamilk-sure-prevent-dong-hanh-cung-phong-trao-ren-luyen-suc-khoe-nguoi-cao-tuoi-20180524072502883.htm
tầm soát và điều trị bệnh lý tim mạch ở người cao tuổi,https://dantri.com.vn/suc-khoe/tam-soat-va-dieu-tri-benh-ly-tim-mach-o-nguoi-cao-tuoi-1411555391.htm
mỗi người cao tuổi sống tại cộng đồng mắc 3 bệnh mạn tính,https://dantri.com.vn/suc-khoe/moi-nguoi-cao-tuoi-song-tai-cong-dong-mac-3-benh-man-tinh-1412390181.htm
chế độ dinh dưỡng và thuốc men hợp với người cao tuổi,https://dantri.com.vn/suc-khoe/che-do-dinh-duong-va-thuoc-men-hop-voi-nguoi-cao-tuoi-1349461000.htm
tiêm phòng cúm hàng năm ở người cao tuổi làm giảm nguy cơ tử vong,https://dantri.com.vn/khoa-hoc/tiem-phong-cum-hang-nam-o-nguoi-cao-tuoi-lam-giam-nguy-co-tu-vong-20180202070744145.htm
cách nào giảm thiểu rủi ro cho người cao tuổi bị bệnh khớp?,https://dantri.com.vn/suc-khoe/cach-nao-giam-thieu-rui-ro-cho-nguoi-cao-tuoi-bi-benh-khop-1398735017.htm
đau tim có thể là dấu hiệu sớm của bệnh ung thư ở người cao tuổi,https://dantri.com.vn/suc-khoe/dau-tim-co-the-la-dau-hieu-som-cua-benh-ung-thu-o-nguoi-cao-tuoi-20181223063506148.htm
nòng cốt trong phong trào toàn dân chăm sóc người cao tuổi,https://dantri.com.vn/xa-hoi/nong-cot-trong-phong-trao-toan-dan-cham-soc-nguoi-cao-tuoi-1349461188.htm
4 nội dung hợp tác quan trọng giữa hội khvn và hội người cao tuổi,https://dantri.com.vn/giao-duc/4-noi-dung-hop-tac-quan-trong-giua-hoi-khvn-va-hoi-nguoi-cao-tuoi-1169289843.htm
ưu tiên thủ tục hàng không cho gia đình có trẻ em và người cao tuổi,https://dantri.com.vn/doi-song/uu-tien-thu-tuc-hang-khong-cho-gia-dinh-co-tre-em-va-nguoi-cao-tuoi-20180602073611038.htm
dinh dưỡng cho vấn đề suy giảm trí nhớ ở người cao tuổi,https://dantri.com.vn/tu-van/dinh-duong-cho-van-de-suy-giam-tri-nho-o-nguoi-cao-tuoi-1376181173.htm
bộ công an khởi tố vụ án liên quan đến báo người cao tuổi,https://dantri.com.vn/xa-hoi/bo-cong-an-khoi-to-vu-an-lien-quan-den-bao-nguoi-cao-tuoi-1424136154.htm
người cao tuổi nhất thế giới thượng thọ 115 tuổi,https://dantri.com.vn/doi-song/nguoi-cao-tuoi-nhat-the-gioi-thuong-tho-115-tuoi-1208864540.htm
xuất hiện người đàn ông có thể sẽ soán ngôi vị người cao tuổi nhất thế giới,https://dantri.com.vn/doi-song/xuat-hien-nguoi-dan-ong-co-the-se-soan-ngoi-vi-nguoi-cao-tuoi-nhat-the-gioi-20191010085711753.htm
"bộ y tế: ưu tiên vắc xin cho lực lượng y tế, người cao tuổi, có bệnh nền",https://dantri.com.vn/suc-khoe/bo-y-te-uu-tien-vac-xin-cho-luc-luong-y-te-nguoi-cao-tuoi-co-benh-nen-20210828132938204.htm
du lịch tự túc không dành cho gia đình có con nhỏ và người cao tuổi,https://dantri.com.vn/du-lich/du-lich-tu-tuc-khong-danh-cho-gia-dinh-co-con-nho-va-nguoi-cao-tuoi-20180512203902959.htm
sẽ hỗ trợ phụng dưỡng cặp vợ chồng người cao tuổi chỉ có con gái?,https://dantri.com.vn/suc-khoe/se-ho-tro-phung-duong-cap-vo-chong-nguoi-cao-tuoi-chi-co-con-gai-20150928115456163.htm
chiết xuất từ mầm bông cải xanh - tốt cho sức khỏe cho người cao tuổi,https://dantri.com.vn/suc-khoe/chiet-xuat-tu-mam-bong-cai-xanh-tot-cho-suc-khoe-cho-nguoi-cao-tuoi-20151123202539862.htm
người cao tuổi nhất thế giới qua đời ở tuổi 115,https://dantri.com.vn/the-gioi/nguoi-cao-tuoi-nhat-the-gioi-qua-doi-o-tuoi-115-1231139058.htm
các yếu tố nguy cơ dẫn tới thiếu máu não ở người cao tuổi,https://dantri.com.vn/suc-khoe/cac-yeu-to-nguy-co-dan-toi-thieu-mau-nao-o-nguoi-cao-tuoi-1382277002.htm
đồng diễn thể dục dưỡng sinh có số lượng người cao tuổi tham gia đông nhất,https://dantri.com.vn/the-thao-trong-nuoc/dong-dien-the-duc-duong-sinh-co-so-luong-nguoi-cao-tuoi-tham-gia-dong-nhat-20170120125658976.htm
"nơi sống lý tưởng cho người cao tuổi giữa thủ đô: gần con gần cháu, gần cả thiên nhiên",https://dantri.com.vn/bat-dong-san/noi-song-ly-tuong-cho-nguoi-cao-tuoi-giua-thu-do-gan-con-gan-chau-gan-ca-thien-nhien-20210604140908224.htm
cụ bà israel soán ngôi người cao tuổi nhất thế giới?,https://dantri.com.vn/doi-song/cu-ba-israel-soan-ngoi-nguoi-cao-tuoi-nhat-the-gioi-1203526213.htm
công ty dược phẩm tâm bình quan tâm tới sức khỏe người cao tuổi,https://dantri.com.vn/tu-van/cong-ty-duoc-pham-tam-binh-quan-tam-toi-suc-khoe-nguoi-cao-tuoi-1350070620.htm
"""hành trình nhân ái 2022"" gửi tặng 40.000 máy đo huyết áp đến người cao tuổi trên khắp cả nước",https://dantri.com.vn/doi-song/hanh-trinh-nhan-ai-2022-gui-tang-40000-may-do-huyet-ap-den-nguoi-cao-tuoi-tren-khap-ca-nuoc-20220114090205939.htm
người cao tuổi có thể dựa vào tập thể dục để giảm thiểu sự ốm yếu tàn tật,https://dantri.com.vn/khoa-hoc/nguoi-cao-tuoi-co-the-dua-vao-tap-the-duc-de-giam-thieu-su-om-yeu-tan-tat-20180124065035155.htm
hội diễn thể dục dưỡng sinh - hoạt động ý nghĩa của người cao tuổi,https://dantri.com.vn/tu-van/hoi-dien-the-duc-duong-sinh-hoat-dong-y-nghia-cua-nguoi-cao-tuoi-1293299037.htm
100.000 suất khám bệnh miễn phí - món quà thiết thực dành cho người cao tuổi,https://dantri.com.vn/tu-van/100000-suat-kham-benh-mien-phi-mon-qua-thiet-thuc-danh-cho-nguoi-cao-tuoi-1334581967.htm
ai mới đích thực là “người cao tuổi nhất thế giới”?,https://dantri.com.vn/doi-song/ai-moi-dich-thuc-la-nguoi-cao-tuoi-nhat-the-gioi-1152296426.htm
phổ biến kiến thức về xương khớp cho hơn 200 người cao tuổi tại vietnam medi-pharm 2016,https://dantri.com.vn/tu-van/pho-bien-kien-thuc-ve-xuong-khop-cho-hon-200-nguoi-cao-tuoi-tai-vietnam-medi-pharm-2016-20160513145919578.htm
"cần nỗ lực để vai trò và sự đóng góp của người cao tuổi được ghi nhận, hỗ trợ",https://dantri.com.vn/phong-su-tre/can-no-luc-de-vai-tro-va-su-dong-gop-cua-nguoi-cao-tuoi-duoc-ghi-nhan-ho-tro-2015111623230448.htm
ăn ít muối có thể rất nguy hiểm cho người cao tuổi,https://dantri.com.vn/suc-khoe/an-it-muoi-co-the-rat-nguy-hiem-cho-nguoi-cao-tuoi-1117259999.htm
suy giảm thị lực dẫn đến mù lòa ở người cao tuổi: nguyên nhân và giải pháp,https://dantri.com.vn/tu-van/suy-giam-thi-luc-dan-den-mu-loa-o-nguoi-cao-tuoi-nguyen-nhan-va-giai-phap-1288621524.htm
tphcm già hóa dân số,https://dantri.com.vn/xa-hoi/tphcm-gia-hoa-dan-so-20250107155219168.htm
nền kinh tế cho người già,https://dantri.com.vn/tam-diem/nen-kinh-te-cho-nguoi-gia-20241001084522604.htm
đô thị sun group hà nam: món quà tình thân giá trị cho mẹ cha an hưởng tuổi già,https://dantri.com.vn/bat-dong-san/do-thi-sun-group-ha-nam-mon-qua-tinh-than-gia-tri-cho-me-cha-an-huong-tuoi-gia-20241121112356371.htm
"từ chuyện mức phí ""nhà già"" và khả năng chi trả của người già",https://dantri.com.vn/tam-diem/tu-chuyen-muc-phi-nha-gia-va-kha-nang-chi-tra-cua-nguoi-gia-20240805005115399.htm
"hành trình tìm lại đôi mắt sáng, khỏe mạnh của cụ ông 77 tuổi",https://dantri.com.vn/suc-khoe/hanh-trinh-tim-lai-doi-mat-sang-khoe-manh-cua-cu-ong-77-tuoi-20241021213951699.htm
