title,link
100% người cao tuổi có thẻ bảo hiểm y tế khi nào?,https://dantri.com.vn/lao-dong-viec-lam/100-nguoi-cao-tuoi-co-the-bao-hiem-y-te-khi-nao-20250225202353708.htm
mức trợ cấp cho người cao tuổi năm 2025,https://dantri.com.vn/lao-dong-viec-lam/muc-tro-cap-cho-nguoi-cao-tuoi-nam-2025-20250210145803030.htm
thông tin mới vụ 50 người cao tuổi miền núi xuống thành phố dự hội thảo,https://dantri.com.vn/lao-dong-viec-lam/thong-tin-moi-vu-50-nguoi-cao-tuoi-mien-nui-xuong-thanh-pho-du-hoi-thao-20250312124144669.htm
50 người cao tuổi ở miền núi xuống thành phố dự hội thảo được vận động về,https://dantri.com.vn/lao-dong-viec-lam/50-nguoi-cao-tuoi-o-mien-nui-xuong-thanh-pho-du-hoi-thao-duoc-van-dong-ve-20250311113250282.htm
vì sao hàng trăm nghìn người cao tuổi sắp có lương hưu?,https://dantri.com.vn/lao-dong-viec-lam/vi-sao-hang-tram-nghin-nguoi-cao-tuoi-sap-co-luong-huu-20250123101636795.htm
vụ 50 người cao tuổi xuống phố dự hội thảo: chính quyền địa phương nói gì?,https://dantri.com.vn/lao-dong-viec-lam/vu-50-nguoi-cao-tuoi-xuong-pho-du-hoi-thao-chinh-quyen-dia-phuong-noi-gi-20250315141403672.htm
hàng triệu người cao tuổi ngóng tiền hưu trí xã hội mới,https://dantri.com.vn/lao-dong-viec-lam/hang-trieu-nguoi-cao-tuoi-ngong-tien-huu-tri-xa-hoi-moi-20241206201718030.htm
"tương lai không xa là ""kỷ nguyên của người cao tuổi""",https://dantri.com.vn/lao-dong-viec-lam/tuong-lai-khong-xa-la-ky-nguyen-cua-nguoi-cao-tuoi-20240930234537810.htm
phòng khám đa khoa quốc tế việt - nga chung tay bảo vệ sức khỏe người cao tuổi,https://dantri.com.vn/suc-khoe/phong-kham-da-khoa-quoc-te-viet-nga-chung-tay-bao-ve-suc-khoe-nguoi-cao-tuoi-20250213120647803.htm
một phường tổ chức lễ mừng thọ cho 111 người cao tuổi,https://dantri.com.vn/lao-dong-viec-lam/mot-phuong-to-chuc-le-mung-tho-cho-111-nguoi-cao-tuoi-20250202173744734.htm
gần 1.600 người cao tuổi nghệ an đảm nhiệm chức vụ bí thư chi bộ,https://dantri.com.vn/lao-dong-viec-lam/gan-1600-nguoi-cao-tuoi-nghe-an-dam-nhiem-chuc-vu-bi-thu-chi-bo-20241106140205080.htm
người cao tuổi hà nội được dùng thẻ xe buýt miễn phí không thời hạn,https://dantri.com.vn/xa-hoi/nguoi-cao-tuoi-ha-noi-duoc-dung-the-xe-buyt-mien-phi-khong-thoi-han-20241030152728891.htm
"""người cao tuổi là kho tàng tri thức và những bài học quý giá""",https://dantri.com.vn/lao-dong-viec-lam/nguoi-cao-tuoi-la-kho-tang-tri-thuc-va-nhung-bai-hoc-quy-gia-20240928134159511.htm
người cao tuổi khấp khởi khi được giảm 5 tuổi hưởng trợ cấp hưu trí,https://dantri.com.vn/lao-dong-viec-lam/nguoi-cao-tuoi-khap-khoi-khi-duoc-giam-5-tuoi-huong-tro-cap-huu-tri-20250206110505043.htm
"xuyên đêm vận động người cao tuổi không tham gia ""du lịch miễn phí""",https://dantri.com.vn/lao-dong-viec-lam/xuyen-dem-van-dong-nguoi-cao-tuoi-khong-tham-gia-du-lich-mien-phi-20241210143146557.htm
"mùa mưa, cẩn trọng cúm mùa đe dọa sức khỏe người cao tuổi",https://dantri.com.vn/suc-khoe/mua-mua-can-trong-cum-mua-de-doa-suc-khoe-nguoi-cao-tuoi-20240801220742853.htm
tăng mức trợ giúp xã hội với người cao tuổi không có lương hưu,https://dantri.com.vn/lao-dong-viec-lam/tang-muc-tro-giup-xa-hoi-voi-nguoi-cao-tuoi-khong-co-luong-huu-20240708094752375.htm
người cao tuổi oằn mình dọn dẹp khi nước rút sau lũ lụt,https://dantri.com.vn/video/nguoi-cao-tuoi-oan-minh-don-dep-khi-nuoc-rut-sau-lu-lut-175242.htm
"nắng nóng gia tăng, hàng triệu người cao tuổi đối mặt nguy hiểm",https://dantri.com.vn/khoa-hoc/nang-nong-gia-tang-hang-trieu-nguoi-cao-tuoi-doi-mat-nguy-hiem-20240515152333795.htm
"gánh nặng ""trẻ nuôi con, già trông cháu"" với người cao tuổi trung quốc",https://dantri.com.vn/the-gioi/ganh-nang-tre-nuoi-con-gia-trong-chau-voi-nguoi-cao-tuoi-trung-quoc-20240606101839806.htm
khi nào mọi người cao tuổi ở việt nam đều có thu nhập hằng tháng?,https://dantri.com.vn/lao-dong-viec-lam/khi-nao-moi-nguoi-cao-tuoi-o-viet-nam-deu-co-thu-nhap-hang-thang-20241002114947572.htm
tăng huyết áp ở người cao tuổi,https://dantri.com.vn/suc-khoe/tang-huyet-ap-o-nguoi-cao-tuoi-20201223084856227.htm
trợ cấp cho người cao tuổi trong năm 2024,https://dantri.com.vn/lao-dong-viec-lam/tro-cap-cho-nguoi-cao-tuoi-trong-nam-2024-20240208073028030.htm
lao động người cao tuổi,https://dantri.com.vn/tam-diem/lao-dong-nguoi-cao-tuoi-20230218185533660.htm
thị trường lao động cho người cao tuổi,https://dantri.com.vn/video/thi-truong-lao-dong-cho-nguoi-cao-tuoi-80631.htm
tiểu són - bệnh khó nói ở người cao tuổi,https://dantri.com.vn/doi-song/tieu-son-benh-kho-noi-o-nguoi-cao-tuoi-20230104093949541.htm
chia sẻ của người cao tuổi tiểu biểu,https://dantri.com.vn/video/chia-se-cua-nguoi-cao-tuoi-tieu-bieu-124369.htm
tư tưởng hồ chí minh về người cao tuổi,https://dantri.com.vn/xa-hoi/tu-tuong-ho-chi-minh-ve-nguoi-cao-tuoi-20221005072200442.htm
thực phẩm tốt cho người cao tuổi,https://dantri.com.vn/suc-khoe/thuc-pham-tot-cho-nguoi-cao-tuoi-20170821105945949.htm
tyler perry trả tiền mua đồ thay người cao tuổi,https://dantri.com.vn/video/tyler-perry-tra-tien-mua-do-thay-nguoi-cao-tuoi-118362.htm
đề xuất cho người cao tuổi vay vốn khởi nghiệp,https://dantri.com.vn/lao-dong-viec-lam/de-xuat-cho-nguoi-cao-tuoi-vay-von-khoi-nghiep-20230926114008571.htm
ăn vui sống khoẻ như người cao tuổi,https://dantri.com.vn/suc-khoe/an-vui-song-khoe-nhu-nguoi-cao-tuoi-20160616102013006.htm
"mức trợ cấp với người cao tuổi có thể tăng lên 2,25 triệu đồng/tháng",https://dantri.com.vn/lao-dong-viec-lam/muc-tro-cap-voi-nguoi-cao-tuoi-co-the-tang-len-225-trieu-dongthang-20240516052943425.htm
vinamilk và “tháng hành động vì người cao tuổi”,https://dantri.com.vn/doi-song/vinamilk-va-thang-hanh-dong-vi-nguoi-cao-tuoi-201512111440351.htm
giới trẻ theo học trường đại học dành cho người cao tuổi,https://dantri.com.vn/video/gioi-tre-theo-hoc-truong-dai-hoc-danh-cho-nguoi-cao-tuoi-167852.htm
bộ trưởng bộ y tế nói về đề xuất hỗ trợ bảo hiểm y tế cho người cao tuổi,https://dantri.com.vn/lao-dong-viec-lam/bo-truong-bo-y-te-noi-ve-de-xuat-ho-tro-bao-hiem-y-te-cho-nguoi-cao-tuoi-20241031183646776.htm
"""bảo đảm 100% người cao tuổi có bảo hiểm y tế""",https://dantri.com.vn/lao-dong-viec-lam/bao-dam-100-nguoi-cao-tuoi-co-bao-hiem-y-te-20230630183918385.htm
giải bài toán tài chính cho người cao tuổi,https://dantri.com.vn/kinh-doanh/giai-bai-toan-tai-chinh-cho-nguoi-cao-tuoi-20161219175110959.htm
người cao tuổi nhật bản tăng lên mức kỷ lục mới,https://dantri.com.vn/the-gioi/nguoi-cao-tuoi-nhat-ban-tang-len-muc-ky-luc-moi-20210920200106688.htm
người cao tuổi khi đi làm có bị cắt lương hưu?,https://dantri.com.vn/lao-dong-viec-lam/nguoi-cao-tuoi-khi-di-lam-co-bi-cat-luong-huu-20230108074412390.htm
thoái hóa khớp - nỗi ám ảnh của người cao tuổi,https://dantri.com.vn/suc-khoe/thoai-hoa-khop-noi-am-anh-cua-nguoi-cao-tuoi-20220624084336984.htm
thái lan khuyến khích người cao tuổi làm việc,https://dantri.com.vn/lao-dong-viec-lam/thai-lan-khuyen-khich-nguoi-cao-tuoi-lam-viec-20160929072514303.htm
sắp diễn ra liên hoan tiếng hát người cao tuổi toàn quốc năm 2023,https://dantri.com.vn/giai-tri/sap-dien-ra-lien-hoan-tieng-hat-nguoi-cao-tuoi-toan-quoc-nam-2023-20231017112306012.htm
hải phòng: tổ chức tặng quà mừng thọ người cao tuổi,https://dantri.com.vn/lao-dong-viec-lam/hai-phong-to-chuc-tang-qua-mung-tho-nguoi-cao-tuoi-20210109130042461.htm
cơ hội sang nhật làm chăm sóc viên với người cao tuổi,https://dantri.com.vn/lao-dong-viec-lam/co-hoi-sang-nhat-lam-cham-soc-vien-voi-nguoi-cao-tuoi-20230112163416714.htm
"nghiên cứu ""màn 2 cuộc đời"" cho người cao tuổi, tại sao không?",https://dantri.com.vn/lao-dong-viec-lam/nghien-cuu-man-2-cuoc-doi-cho-nguoi-cao-tuoi-tai-sao-khong-20211001104019646.htm
tã giấy cho người cao tuổi mắc rối loạn bài tiết,https://dantri.com.vn/suc-khoe/ta-giay-cho-nguoi-cao-tuoi-mac-roi-loan-bai-tiet-20221104062130157.htm
người cao tuổi “nai lưng” đóng quỹ xóm,https://dantri.com.vn/xa-hoi/nguoi-cao-tuoi-nai-lung-dong-quy-xom-20171124161853961.htm
những lưu ý dinh dưỡng cho người cao tuổi,https://dantri.com.vn/suc-khoe/nhung-luu-y-dinh-duong-cho-nguoi-cao-tuoi-20160112100934157.htm
"“bí kíp” giúp người cao tuổi sống lâu, sống khỏe",https://dantri.com.vn/doi-song/bi-kip-giup-nguoi-cao-tuoi-song-lau-song-khoe-20160812174219947.htm
tri ân người cao tuổi nhân ngày truyền thống,https://dantri.com.vn/doi-song/tri-an-nguoi-cao-tuoi-nhan-ngay-truyen-thong-20160607152938416.htm
người cao tuổi: điên vì… cô đơn?,https://dantri.com.vn/suc-khoe/nguoi-cao-tuoi-dien-vi-co-don-1387732964.htm
"tạo việc làm cho người cao tuổi: ""một mũi tên trúng nhiều đích...""",https://dantri.com.vn/lao-dong-viec-lam/tao-viec-lam-cho-nguoi-cao-tuoi-mot-mui-ten-trung-nhieu-dich-20210605133229009.htm
vinamilk chăm sóc sức khoẻ người cao tuổi,https://dantri.com.vn/tu-van/vinamilk-cham-soc-suc-khoe-nguoi-cao-tuoi-1396941813.htm
người cao tuổi có nguy cơ tự tử cao hơn?,https://dantri.com.vn/khoa-hoc/nguoi-cao-tuoi-co-nguy-co-tu-tu-cao-hon-20181018084150225.htm
căn hộ chăm sóc sức khỏe cho người cao tuổi ở tphcm,https://dantri.com.vn/bat-dong-san/can-ho-cham-soc-suc-khoe-cho-nguoi-cao-tuoi-o-tphcm-20220520070902065.htm
tại sao người cao tuổi ngủ kém hơn?,https://dantri.com.vn/khoa-hoc/tai-sao-nguoi-cao-tuoi-ngu-kem-hon-20170413103909569.htm
tổng bí thư: người cao tuổi là vốn quý của dân tộc,https://dantri.com.vn/lao-dong-viec-lam/tong-bi-thu-nguoi-cao-tuoi-la-von-quy-cua-dan-toc-20220113201342056.htm
chủ tịch nước: người cao tuổi là trụ cột của gia đình và xã hội,https://dantri.com.vn/xa-hoi/chu-tich-nuoc-nguoi-cao-tuoi-la-tru-cot-cua-gia-dinh-va-xa-hoi-20210928203341179.htm
"chăm sóc người cao tuổi ""xịn"" kiểu nhật bản",https://dantri.com.vn/suc-khoe/cham-soc-nguoi-cao-tuoi-xin-kieu-nhat-ban-20171103152004941.htm
biến chứng do sốt cao ở người cao tuổi,https://dantri.com.vn/suc-khoe/bien-chung-do-sot-cao-o-nguoi-cao-tuoi-20161229055827297.htm
hội người cao tuổi việt nam ký hợp tác với hệ thống bệnh viện mắt sài gòn,https://dantri.com.vn/suc-khoe/hoi-nguoi-cao-tuoi-viet-nam-ky-hop-tac-voi-he-thong-benh-vien-mat-sai-gon-20240411172526930.htm
người cao tuổi cũng học tiêu dùng qua app ngân hàng,https://dantri.com.vn/kinh-doanh/nguoi-cao-tuoi-cung-hoc-tieu-dung-qua-app-ngan-hang-20210701112916427.htm
người cao tuổi cần phải tăng cường sức khỏe chủ động,https://dantri.com.vn/suc-khoe/nguoi-cao-tuoi-can-phai-tang-cuong-suc-khoe-chu-dong-20200227194043187.htm
những điều người cao tuổi cần biết khi tiêm vaccine covid-19,https://dantri.com.vn/video/nhung-dieu-nguoi-cao-tuoi-can-biet-khi-tiem-vaccine-covid19-148887.htm
đà nẵng: phấn đấu để 100% người cao tuổi có thẻ bảo hiểm y tế,https://dantri.com.vn/lao-dong-viec-lam/da-nang-phan-dau-de-100-nguoi-cao-tuoi-co-the-bao-hiem-y-te-20221228192848349.htm
người cao tuổi vẫn cần sống năng động,https://dantri.com.vn/tu-van/nguoi-cao-tuoi-van-can-song-nang-dong-1399950364.htm
"ưu tiên chăm sóc, bảo vệ người cao tuổi trong đại dịch covid-19",https://dantri.com.vn/lao-dong-viec-lam/uu-tien-cham-soc-bao-ve-nguoi-cao-tuoi-trong-dai-dich-covid-19-20210605154947446.htm
vingroup mở trung tâm chăm sóc người cao tuổi tại vinhomes ocean park 2,https://dantri.com.vn/bat-dong-san/vingroup-mo-trung-tam-cham-soc-nguoi-cao-tuoi-tai-vinhomes-ocean-park-2-20240328093120304.htm
bệnh nào ảnh hưởng nhiều nhất đến sức khỏe người cao tuổi ở tphcm?,https://dantri.com.vn/suc-khoe/benh-nao-anh-huong-nhieu-nhat-den-suc-khoe-nguoi-cao-tuoi-o-tphcm-20230928022128864.htm
nutifood tham gia chăm sóc sức khỏe cho người cao tuổi,https://dantri.com.vn/doi-song/nutifood-tham-gia-cham-soc-suc-khoe-cho-nguoi-cao-tuoi-20180206113623621.htm
"phương pháp ""chăm sóc điều dưỡng hỗ trợ tự lập"" cho người cao tuổi",https://dantri.com.vn/video/phuong-phap-cham-soc-dieu-duong-ho-tro-tu-lap-cho-nguoi-cao-tuoi-165817.htm
tắm onsen - bí quyết sức khỏe của người cao tuổi nhật bản,https://dantri.com.vn/bat-dong-san/tam-onsen-bi-quyet-suc-khoe-cua-nguoi-cao-tuoi-nhat-ban-20201124075150697.htm
vinamilk chăm sóc sức khỏe cho hơn 500 người cao tuổi,https://dantri.com.vn/doi-song/vinamilk-cham-soc-suc-khoe-cho-hon-500-nguoi-cao-tuoi-20170620073539295.htm
"người cao tuổi châu âu vật lộn trong ""sóng nhiệt"" trên 40 độ c",https://dantri.com.vn/the-gioi/nguoi-cao-tuoi-chau-au-vat-lon-trong-song-nhiet-tren-40-do-c-20230721085657805.htm
tạm giữ hình sự 4 phụ nữ chuyên lừa tiền của người cao tuổi,https://dantri.com.vn/phap-luat/tam-giu-hinh-su-4-phu-nu-chuyen-lua-tien-cua-nguoi-cao-tuoi-20240318200441081.htm
"làn sóng ""người cao tuổi kỹ thuật số"" bùng nổ ở châu á",https://dantri.com.vn/cong-nghe/lan-song-nguoi-cao-tuoi-ky-thuat-so-bung-no-o-chau-a-20220123230806170.htm
hành trình 4 năm chăm sóc sức khỏe người cao tuổi,https://dantri.com.vn/doi-song/hanh-trinh-4-nam-cham-soc-suc-khoe-nguoi-cao-tuoi-20160908151402787.htm
tưng bừng ngày hội “hoan hỉ” của người cao tuổi,https://dantri.com.vn/tu-van/tung-bung-ngay-hoi-hoan-hi-cua-nguoi-cao-tuoi-1396260984.htm
"tphcm có hơn 1 triệu người cao tuổi, báo động tình trạng ""ngại đẻ""",https://dantri.com.vn/suc-khoe/tphcm-co-hon-1-trieu-nguoi-cao-tuoi-bao-dong-tinh-trang-ngai-de-20231210114528467.htm
người cao tuổi có được miễn tiền án phí và lệ phí tòa?,https://dantri.com.vn/ban-doc/nguoi-cao-tuoi-co-duoc-mien-tien-an-phi-va-le-phi-toa-20220821082823636.htm
"caryn khởi động ""ngày hội chăm sóc sức khỏe"", hướng đến người cao tuổi",https://dantri.com.vn/suc-khoe/caryn-khoi-dong-ngay-hoi-cham-soc-suc-khoe-huong-den-nguoi-cao-tuoi-20231101170414259.htm
kingsport triển khai chuỗi hoạt động vì người cao tuổi trong tháng vu lan,https://dantri.com.vn/kinh-doanh/kingsport-trien-khai-chuoi-hoat-dong-vi-nguoi-cao-tuoi-trong-thang-vu-lan-20230830190155404.htm
nutifood chăm sóc sức khỏe miễn phí cho người cao tuổi quận 9,https://dantri.com.vn/doi-song/nutifood-cham-soc-suc-khoe-mien-phi-cho-nguoi-cao-tuoi-quan-9-20180612120207478.htm
thực phẩm có lợi cho người cao tuổi,https://dantri.com.vn/tu-van/thuc-pham-co-loi-cho-nguoi-cao-tuoi-1346013489.htm
hệ thống viện dưỡng lão tiện nghi cho người cao tuổi giữa lòng tphcm,https://dantri.com.vn/suc-khoe/he-thong-vien-duong-lao-tien-nghi-cho-nguoi-cao-tuoi-giua-long-tphcm-20231219062227720.htm
thành phố thân thiện với người cao tuổi,https://dantri.com.vn/xa-hoi/thanh-pho-than-thien-voi-nguoi-cao-tuoi-1317786285.htm
khó như chăm sóc người cao tuổi,https://dantri.com.vn/suc-khoe/kho-nhu-cham-soc-nguoi-cao-tuoi-1312691984.htm
"“chăm sóc người cao tuổi cần thực hiện từng giờ, từng phút”",https://dantri.com.vn/chinh-tri/cham-soc-nguoi-cao-tuoi-can-thuc-hien-tung-gio-tung-phut-20170928112420096.htm
"“chăm sóc người cao tuổi cần thực hiện từng giờ, từng phút”",https://dantri.com.vn/suc-khoe/cham-soc-nguoi-cao-tuoi-can-thuc-hien-tung-gio-tung-phut-20180116102647899.htm
"người cao tuổi ""đi học"" bán trú mỗi ngày",https://dantri.com.vn/lao-dong-viec-lam/nguoi-cao-tuoi-di-hoc-ban-tru-moi-ngay-20230523120514352.htm
dịch vụ chăm sóc cao cấp cho người cao tuổi: tiềm năng còn bỏ ngỏ,https://dantri.com.vn/suc-khoe/dich-vu-cham-soc-cao-cap-cho-nguoi-cao-tuoi-tiem-nang-con-bo-ngo-20240326110944574.htm
"người cao tuổi, trẻ em được giảm ít nhất 20% giá vé xem phim",https://dantri.com.vn/xa-hoi/nguoi-cao-tuoi-tre-em-duoc-giam-it-nhat-20-gia-ve-xem-phim-20230102091630853.htm
kingsport góp 399 triệu đồng vào quỹ chăm sóc và phát huy vai trò người cao tuổi,https://dantri.com.vn/kinh-doanh/kingsport-gop-399-trieu-dong-vao-quy-cham-soc-va-phat-huy-vai-tro-nguoi-cao-tuoi-20231026103713023.htm
​vinamilk đồng hành chăm sóc sức khỏe cho gần 2000 người cao tuổi,https://dantri.com.vn/doi-song/vinamilk-dong-hanh-cham-soc-suc-khoe-cho-gan-2000-nguoi-cao-tuoi-20170921124717594.htm
"4,6% người cao tuổi tại cộng đồng mắc sa sút trí tuệ",https://dantri.com.vn/dien-dan/46-nguoi-cao-tuoi-tai-cong-dong-mac-sa-sut-tri-tue-20191022135650578.htm
những căn bệnh nguy hiểm người cao tuổi nên biết,https://dantri.com.vn/suc-khoe/nhung-can-benh-nguy-hiem-nguoi-cao-tuoi-nen-biet-1393972421.htm
"nhiều người cao tuổi suy hô hấp, phải thở máy vì trời rét",https://dantri.com.vn/suc-khoe/nhieu-nguoi-cao-tuoi-suy-ho-hap-phai-tho-may-vi-troi-ret-20210115115325231.htm
"dân số già hóa nhanh, người cao tuổi thiếu sân chơi",https://dantri.com.vn/suc-khoe/dan-so-gia-hoa-nhanh-nguoi-cao-tuoi-thieu-san-choi-20151224065323126.htm
bộ trưởng đào ngọc dung: cần có kế sách tạo việc làm cho người cao tuổi,https://dantri.com.vn/lao-dong-viec-lam/bo-truong-dao-ngoc-dung-can-co-ke-sach-tao-viec-lam-cho-nguoi-cao-tuoi-20220315153332560.htm
phong cách sống năng động truyền cảm hứng đến hàng triệu người cao tuổi,https://dantri.com.vn/doi-song/phong-cach-song-nang-dong-truyen-cam-hung-den-hang-trieu-nguoi-cao-tuoi-20221101051904751.htm
"ngăn dịch covid, đến tận nhà khám chữa bệnh cho người cao tuổi",https://dantri.com.vn/suc-khoe/ngan-dich-covid-den-tan-nha-kham-chua-benh-cho-nguoi-cao-tuoi-20200401162353913.htm
bí quyết vàng cho sức khỏe người cao tuổi,https://dantri.com.vn/tu-van/bi-quyet-vang-cho-suc-khoe-nguoi-cao-tuoi-1384807481.htm
hệ thống dưỡng lão bình mỹ - giải pháp tối ưu chăm sóc người cao tuổi sau tai biến,https://dantri.com.vn/suc-khoe/he-thong-duong-lao-binh-my-giai-phap-toi-uu-cham-soc-nguoi-cao-tuoi-sau-tai-bien-20240427115122252.htm
thúc đẩy hòa nhập cho người khuyết tật và người cao tuổi,https://dantri.com.vn/doi-song/thuc-day-hoa-nhap-cho-nguoi-khuyet-tat-va-nguoi-cao-tuoi-20151209104102496.htm
tphcm nêu quận duy nhất chưa có kế hoạch khám sức khỏe người cao tuổi,https://dantri.com.vn/suc-khoe/tphcm-neu-quan-duy-nhat-chua-co-ke-hoach-kham-suc-khoe-nguoi-cao-tuoi-20240301150333804.htm
những hoạt động đầy ý nghĩa nhân ngày người cao tuổi việt nam,https://dantri.com.vn/doi-song/nhung-hoat-dong-day-y-nghia-nhan-ngay-nguoi-cao-tuoi-viet-nam-20170607073321049.htm
nutifood khám sức khỏe và tư vấn dinh dưỡng cho người cao tuổi,https://dantri.com.vn/doi-song/nutifood-kham-suc-khoe-va-tu-van-dinh-duong-cho-nguoi-cao-tuoi-20170930131435774.htm
nguyên nhân khiến người cao tuổi ăn không ngon,https://dantri.com.vn/tu-van/nguyen-nhan-khien-nguoi-cao-tuoi-an-khong-ngon-1398220874.htm
"bí kíp ăn ngon, tập vui cho người cao tuổi",https://dantri.com.vn/suc-khoe/bi-kip-an-ngon-tap-vui-cho-nguoi-cao-tuoi-20160606102452506.htm
5 nghề “chuộng” người cao tuổi,https://dantri.com.vn/lao-dong-viec-lam/5-nghe-chuong-nguoi-cao-tuoi-1236789357.htm
"chủ tịch nước: hành động để mọi người cao tuổi được quan tâm, chăm sóc tận tình",https://dantri.com.vn/lao-dong-viec-lam/chu-tich-nuoc-hanh-dong-de-moi-nguoi-cao-tuoi-duoc-quan-tam-cham-soc-tan-tinh-20221002120956458.htm
"kingsport phối hợp thực hiện chương trình ""mắt sáng cho người cao tuổi năm 2023""",https://dantri.com.vn/doi-song/kingsport-phoi-hop-thuc-hien-chuong-trinh-mat-sang-cho-nguoi-cao-tuoi-nam-2023-20231218090700927.htm
tã quần caryn góp phần nâng chất lượng sống người cao tuổi việt nam,https://dantri.com.vn/doi-song/ta-quan-caryn-gop-phan-nang-chat-luong-song-nguoi-cao-tuoi-viet-nam-20221228141238169.htm
thực phẩm có lợi cho người cao tuổi,https://dantri.com.vn/tu-van/thuc-pham-co-loi-cho-nguoi-cao-tuoi-1352063282.htm
suy giảm tình dục ở người cao tuổi: hiểu sao cho đúng?,https://dantri.com.vn/suc-khoe/suy-giam-tinh-duc-o-nguoi-cao-tuoi-hieu-sao-cho-dung-2016052315374916.htm
dinh dưỡng cân bằng cho sức khỏe người cao tuổi,https://dantri.com.vn/suc-khoe/dinh-duong-can-bang-cho-suc-khoe-nguoi-cao-tuoi-20160701095037402.htm
bí quyết cải thiện tình trạng nghe kém ở người cao tuổi nhờ kim thính,https://dantri.com.vn/suc-khoe/bi-quyet-cai-thien-tinh-trang-nghe-kem-o-nguoi-cao-tuoi-nho-kim-thinh-20191226082709557.htm
phòng tránh nguy cơ té ngã ở người cao tuổi gặp chứng tiểu đêm,https://dantri.com.vn/suc-khoe/phong-tranh-nguy-co-te-nga-o-nguoi-cao-tuoi-gap-chung-tieu-dem-20211104130500531.htm
ceo abcsport lê trường mạnh tặng người cao tuổi 40.000 máy đo huyết áp,https://dantri.com.vn/kinh-doanh/ceo-abcsport-le-truong-manh-tang-nguoi-cao-tuoi-40000-may-do-huyet-ap-20220217212220339.htm
"""tiếng lòng"" người cao tuổi",https://dantri.com.vn/tu-van/tieng-long-nguoi-cao-tuoi-1377171814.htm
những phản ứng sau tiêm vaccine covid-19 hay gặp ở người cao tuổi,https://dantri.com.vn/suc-khoe/nhung-phan-ung-sau-tiem-vaccine-covid19-hay-gap-o-nguoi-cao-tuoi-20220124162842347.htm
hơn 4.000 người cao tuổi tp.hcm tham gia hội thi thể dục dưỡng sinh,https://dantri.com.vn/doi-song/hon-4000-nguoi-cao-tuoi-tphcm-tham-gia-hoi-thi-the-duc-duong-sinh-20171001213457828.htm
chỉ có 5% người cao tuổi khỏe mạnh,https://dantri.com.vn/suc-khoe/chi-co-5-nguoi-cao-tuoi-khoe-manh-1334124868.htm
táo bón ở người cao tuổi: không nên chủ quan,https://dantri.com.vn/tu-van/tao-bon-o-nguoi-cao-tuoi-khong-nen-chu-quan-1384093804.htm
báo động tình trạng thiếu trầm trọng nhân viên chăm sóc người cao tuổi,https://dantri.com.vn/lao-dong-viec-lam/bao-dong-tinh-trang-thieu-tram-trong-nhan-vien-cham-soc-nguoi-cao-tuoi-20210810162302942.htm
"ngăn ngừa thoái hóa xương khớp cho người cao tuổi, bạn biết cách chưa?",https://dantri.com.vn/suc-khoe/ngan-ngua-thoai-hoa-xuong-khop-cho-nguoi-cao-tuoi-ban-biet-cach-chua-20201019003326035.htm
người cao tuổi hàn quốc tham gia lao động tăng cao kỷ lục,https://dantri.com.vn/video/nguoi-cao-tuoi-han-quoc-tham-gia-lao-dong-tang-cao-ky-luc-53396.htm
tặng 2.000 sản phẩm dầu ngải diệp dược nam hà cho người cao tuổi,https://dantri.com.vn/suc-khoe/tang-2000-san-pham-dau-ngai-diep-duoc-nam-ha-cho-nguoi-cao-tuoi-20211019140000633.htm
những sai lầm phổ biến trong chăm sóc người cao tuổi,https://dantri.com.vn/tu-van/nhung-sai-lam-pho-bien-trong-cham-soc-nguoi-cao-tuoi-20170721104851244.htm
"chủ tịch hội người cao tuổi ""ôm"" tiền bỏ trốn",https://dantri.com.vn/xa-hoi/chu-tich-hoi-nguoi-cao-tuoi-om-tien-bo-tron-1411674143.htm
"căn bệnh ung thư diễn tiến thầm lặng, thường gặp nhất ở người cao tuổi",https://dantri.com.vn/suc-khoe/can-benh-ung-thu-dien-tien-tham-lang-thuong-gap-nhat-o-nguoi-cao-tuoi-20220924171538924.htm
"người cao tuổi châu á muốn làm việc, tiếp tục đóng góp cho xã hội",https://dantri.com.vn/video/nguoi-cao-tuoi-chau-a-muon-lam-viec-tiep-tuc-dong-gop-cho-xa-hoi-107807.htm
chụp ảnh người cao tuổi miễn phí nhưng vẫn thu tiền triệu: tự nguyện đóng?,https://dantri.com.vn/xa-hoi/chup-anh-nguoi-cao-tuoi-mien-phi-nhung-van-thu-tien-trieu-tu-nguyen-dong-20230323102148403.htm
người cao tuổi thái lan vẫn có thể làm ra tiền trong trại dưỡng lão,https://dantri.com.vn/lao-dong-viec-lam/nguoi-cao-tuoi-thai-lan-van-co-the-lam-ra-tien-trong-trai-duong-lao-2018102009273836.htm
thủ tướng: người cao tuổi là chỗ dựa vững chắc cho các thế hệ con cháu,https://dantri.com.vn/xa-hoi/thu-tuong-nguoi-cao-tuoi-la-cho-dua-vung-chac-cho-cac-the-he-con-chau-20231116122736760.htm
xu hướng người cao tuổi muốn tiếp tục làm việc tại châu á,https://dantri.com.vn/lao-dong-viec-lam/xu-huong-nguoi-cao-tuoi-muon-tiep-tuc-lam-viec-tai-chau-a-20190212230600508.htm
đau xương khớp ở người cao tuổi - hãy quan tâm nhiều hơn,https://dantri.com.vn/tu-van/dau-xuong-khop-o-nguoi-cao-tuoi-hay-quan-tam-nhieu-hon-20161110074743855.htm
vì sao người cao tuổi nên ngủ trưa khoảng 1 tiếng?,https://dantri.com.vn/suc-khoe/vi-sao-nguoi-cao-tuoi-nen-ngu-trua-khoang-1-tieng-20170110095406005.htm
đa số người cao tuổi ở hàn quốc muốn được làm việc thêm,https://dantri.com.vn/lao-dong-viec-lam/da-so-nguoi-cao-tuoi-o-han-quoc-muon-duoc-lam-viec-them-20190724073828561.htm
vinamilk chăm sóc sức khỏe cho hơn 1.600 người cao tuổi,https://dantri.com.vn/doi-song/vinamilk-cham-soc-suc-khoe-cho-hon-1600-nguoi-cao-tuoi-20151111070619729.htm
