title,link
trung quốc: trường đại học dành cho người cao tuổi,https://dantri.com.vn/giao-duc/trung-quoc-truong-dai-hoc-danh-cho-nguoi-cao-tuoi-1423013664.htm
giải pháp dinh dưỡng cho những vấn đề tiêu hóa của người cao tuổi,https://dantri.com.vn/suc-khoe/giai-phap-dinh-duong-cho-nhung-van-de-tieu-hoa-cua-nguoi-cao-tuoi-20201023154420825.htm
vinamilk chăm sóc sức khỏe cho 10 nghìn người cao tuổi tại 27 tỉnh thành,https://dantri.com.vn/doi-song/vinamilk-cham-soc-suc-khoe-cho-10-nghin-nguoi-cao-tuoi-tai-27-tinh-thanh-20220611085001644.htm
"những cụ ông, cụ bà đại thọ tại việt nam: ai là người cao tuổi nhất?",https://dantri.com.vn/doi-song/nhung-cu-ong-cu-ba-dai-tho-tai-viet-nam-ai-la-nguoi-cao-tuoi-nhat-20240310164249625.htm
vinamilk tổ chức nhiều hoạt động ý nghĩa cho người cao tuổi cả nước,https://dantri.com.vn/doi-song/vinamilk-to-chuc-nhieu-hoat-dong-y-nghia-cho-nguoi-cao-tuoi-ca-nuoc-20191004192106978.htm
"giao mùa, chuyên gia khuyến cáo: không nên xem thường cúm mùa ở người cao tuổi",https://dantri.com.vn/suc-khoe/giao-mua-chuyen-gia-khuyen-cao-khong-nen-xem-thuong-cum-mua-o-nguoi-cao-tuoi-20240322094240901.htm
công nghệ safe tech: trồng răng an toàn và thành công cho người cao tuổi,https://dantri.com.vn/suc-khoe/cong-nghe-safe-tech-trong-rang-an-toan-va-thanh-cong-cho-nguoi-cao-tuoi-20220622070301868.htm
thị trường lao động cho người cao tuổi,https://dantri.com.vn/lao-dong-viec-lam/thi-truong-lao-dong-cho-nguoi-cao-tuoi-2018052122451786.htm
chủ tịch quốc hội chúc tết hội người cao tuổi vn,https://dantri.com.vn/chinh-tri/chu-tich-quoc-hoi-chuc-tet-hoi-nguoi-cao-tuoi-vn-1327166466.htm
đối phó với chứng lãng tai ở người cao tuổi,https://dantri.com.vn/suc-khoe/doi-pho-voi-chung-lang-tai-o-nguoi-cao-tuoi-1412200005.htm
thực phẩm duy trì sức khỏe cho người cao tuổi,https://dantri.com.vn/tu-van/thuc-pham-duy-tri-suc-khoe-cho-nguoi-cao-tuoi-1347127088.htm
có nên tiêm vaccine cúm cho người cao tuổi trước nguy cơ dịch chồng dịch?,https://dantri.com.vn/suc-khoe/co-nen-tiem-vaccine-cum-cho-nguoi-cao-tuoi-truoc-nguy-co-dich-chong-dich-20220814153358374.htm
từ vụ tịnh thất bồng lai: người cao tuổi phạm tội được ưu đãi gì?,https://dantri.com.vn/ban-doc/tu-vu-tinh-that-bong-lai-nguoi-cao-tuoi-pham-toi-duoc-uu-dai-gi-20220107121320712.htm
tphcm miễn phí vé xe buýt cho người cao tuổi,https://dantri.com.vn/xa-hoi/tphcm-mien-phi-ve-xe-buyt-cho-nguoi-cao-tuoi-1389651532.htm
gần 65% người cao tuổi nằm viện bị suy dinh dưỡng,https://dantri.com.vn/suc-khoe/gan-65-nguoi-cao-tuoi-nam-vien-bi-suy-dinh-duong-20161130204854969.htm
cải thiện chức năng ăn nhai cho người cao tuổi như thế nào?,https://dantri.com.vn/suc-khoe/cai-thien-chuc-nang-an-nhai-cho-nguoi-cao-tuoi-nhu-the-nao-20181008142539006.htm
tiêm vaccine và dinh dưỡng - bộ đôi bảo vệ người cao tuổi mùa dịch bệnh,https://dantri.com.vn/suc-khoe/tiem-vaccine-va-dinh-duong-bo-doi-bao-ve-nguoi-cao-tuoi-mua-dich-benh-20211113155047301.htm
người cao tuổi - động lực mới của sự phát triển,https://dantri.com.vn/suc-khoe/nguoi-cao-tuoi-dong-luc-moi-cua-su-phat-trien-1412708782.htm
chữa trầm cảm ở người cao tuổi vì sao lại khó khăn hơn người trẻ tuổi?,https://dantri.com.vn/suc-khoe/chua-tram-cam-o-nguoi-cao-tuoi-vi-sao-lai-kho-khan-hon-nguoi-tre-tuoi-20190425212646101.htm
hơn 100 người cao tuổi hoàn thành tiêm thử vắc xin covid-19 việt nam,https://dantri.com.vn/suc-khoe/hon-100-nguoi-cao-tuoi-hoan-thanh-tiem-thu-vac-xin-covid-19-viet-nam-20210311105403354.htm
chăm sóc người cao tuổi còn nặng tính thương mại,https://dantri.com.vn/xa-hoi/cham-soc-nguoi-cao-tuoi-con-nang-tinh-thuong-mai-1346106950.htm
người cao tuổi dùng thực phẩm chức năng - lợi và hại gì?,https://dantri.com.vn/suc-khoe/nguoi-cao-tuoi-dung-thuc-pham-chuc-nang-loi-va-hai-gi-20160729091524469.htm
chương trình “vinamilk chăm sóc sức khoẻ người cao tuổi” đến tp.hcm,https://dantri.com.vn/tu-van/chuong-trinh-vinamilk-cham-soc-suc-khoe-nguoi-cao-tuoi-den-tphcm-1398094482.htm
nghệ an: “một triệu áo ấm tặng người cao tuổi nghèo”,https://dantri.com.vn/tam-long-nhan-ai/mot-trieu-ao-am-tang-nguoi-cao-tuoi-ngheo-1254640476.htm
công an đến tận nhà đưa đón người cao tuổi đi làm căn cước công dân,https://dantri.com.vn/xa-hoi/cong-an-den-tan-nha-dua-don-nguoi-cao-tuoi-di-lam-can-cuoc-cong-dan-20220729235429331.htm
khiêu vũ có lợi cho sức khỏe não của người cao tuổi,https://dantri.com.vn/khoa-hoc/khieu-vu-co-loi-cho-suc-khoe-nao-cua-nguoi-cao-tuoi-20171016085024235.htm
suy giảm thính lực ở người cao tuổi có chữa được không?,https://dantri.com.vn/suc-khoe/suy-giam-thinh-luc-o-nguoi-cao-tuoi-co-chua-duoc-khong-20190108141117621.htm
đề xuất thành lập vụ sức khoẻ người cao tuổi thuộc tổng cục dân số,https://dantri.com.vn/suc-khoe/de-xuat-thanh-lap-vu-suc-khoe-nguoi-cao-tuoi-thuoc-tong-cuc-dan-so-20170907201441431.htm
để người cao tuổi có giấc ngủ ngon,https://dantri.com.vn/doi-song/de-nguoi-cao-tuoi-co-giac-ngu-ngon-20171107105443771.htm
"nếu chủ quản chấn chỉnh, 'người cao tuổi' đã không sai phạm",https://dantri.com.vn/xa-hoi/neu-chu-quan-chan-chinh-nguoi-cao-tuoi-da-khong-sai-pham-1424648574.htm
phương pháp điều trị mới có thể giúp người cao tuổi “khoẻ” lâu hơn,https://dantri.com.vn/khoa-hoc/phuong-phap-dieu-tri-moi-co-the-giup-nguoi-cao-tuoi-khoe-lau-hon-20200324064057911.htm
"bạc liêu: tấm lòng người cao tuổi được đặt cả tên ""cầu, đường phụ lão""",https://dantri.com.vn/doi-song/bac-lieu-tam-long-nguoi-cao-tuoi-duoc-dat-ca-ten-cau-duong-phu-lao-20200805101442482.htm
người cao tuổi hàn quốc tham gia lao động tăng cao kỷ lục,https://dantri.com.vn/lao-dong-viec-lam/nguoi-cao-tuoi-han-quoc-tham-gia-lao-dong-tang-cao-ky-luc-20161018225820147.htm
ngày hội chống mù lòa cho người cao tuổi - công nghệ mổ mắt phaco ưu việt,https://dantri.com.vn/video/ngay-hoi-chong-mu-loa-cho-nguoi-cao-tuoi-cong-nghe-mo-mat-phaco-uu-viet-153011.htm
phải tăng nhanh tỉ lệ người cao tuổi có bảo hiểm y tế,https://dantri.com.vn/suc-khoe/phai-tang-nhanh-ti-le-nguoi-cao-tuoi-co-bao-hiem-y-te-20160316071626552.htm
bí quyết chăm sóc người cao tuổi chống loét tì đè,https://dantri.com.vn/tu-van/bi-quyet-cham-soc-nguoi-cao-tuoi-chong-loet-ti-de-2015102016273295.htm
người cao tuổi hà nội mệt mỏi chờ làm thẻ xe buýt miễn phí,https://dantri.com.vn/xa-hoi/nguoi-cao-tuoi-ha-noi-met-moi-cho-lam-the-xe-buyt-mien-phi-20190826112536642.htm
"kingsport nối dài sứ mệnh chăm sóc sức khỏe người cao tuổi với ""hành trình hạnh phúc""",https://dantri.com.vn/doi-song/kingsport-noi-dai-su-menh-cham-soc-suc-khoe-nguoi-cao-tuoi-voi-hanh-trinh-hanh-phuc-20240125095253364.htm
"chủ tịch nước thăm, làm việc với hội người cao tuổi",https://dantri.com.vn/chinh-tri/chu-tich-nuoc-tham-lam-viec-voi-hoi-nguoi-cao-tuoi-1341621314.htm
tphcm: gần 3.500 người cao tuổi sẽ được khám bệnh miễn phí,https://dantri.com.vn/tuvan/tphcm-gan-3500-nguoi-cao-tuoi-se-duoc-kham-benh-mien-phi-1407419904.htm
người cao tuổi hà nội mệt mỏi chờ làm thẻ xe buýt miễn phí,https://dantri.com.vn/video/nguoi-cao-tuoi-ha-noi-met-moi-cho-lam-the-xe-buyt-mien-phi-105660.htm
vinamilk khởi động hành trình chăm sóc sức khỏe cho người cao tuổi năm 2017,https://dantri.com.vn/gia-dinh/vinamilk-khoi-dong-hanh-trinh-cham-soc-suc-khoe-cho-nguoi-cao-tuoi-nam-2017-20170315164721838.htm
phó thủ tướng yêu cầu chăm sóc tốt sức khỏe người cao tuổi,https://dantri.com.vn/suc-khoe/pho-thu-tuong-yeu-cau-cham-soc-tot-suc-khoe-nguoi-cao-tuoi-1427882810.htm
người cao tuổi được giảm giá nhiều dịch vụ?,https://dantri.com.vn/xa-hoi/nguoi-cao-tuoi-duoc-giam-gia-nhieu-dich-vu-1235727636.htm
"hơn 5.300 hộp sữa giả, kém chất lượng được lừa bán cho người cao tuổi",https://dantri.com.vn/xa-hoi/hon-5300-hop-sua-gia-kem-chat-luong-duoc-lua-ban-cho-nguoi-cao-tuoi-20210224075158936.htm
đề nghị cách chức tổng biên tập báo người cao tuổi,https://dantri.com.vn/xa-hoi/de-nghi-cach-chuc-tong-bien-tap-bao-nguoi-cao-tuoi-1424116719.htm
gãy xương ở người cao tuổi,https://dantri.com.vn/suc-khoe/gay-xuong-o-nguoi-cao-tuoi-1135018316.htm
hơn một nửa người cao tuổi không bao giờ tập thể dục,https://dantri.com.vn/suc-khoe/hon-mot-nua-nguoi-cao-tuoi-khong-bao-gio-tap-the-duc-20160908043529041.htm
trao 400 suất quà tết tới người cao tuổi nghèo tỉnh thanh hoá,https://dantri.com.vn/lao-dong-viec-lam/trao-400-suat-qua-tet-toi-nguoi-cao-tuoi-ngheo-tinh-thanh-hoa-20170121092834292.htm
khám bệnh miễn phí cho 450 người cao tuổi diện chính sách,https://dantri.com.vn/suc-khoe/kham-benh-mien-phi-cho-450-nguoi-cao-tuoi-dien-chinh-sach-20161211225014946.htm
6 nguyên tắc vàng cho sức khỏe người cao tuổi,https://dantri.com.vn/suc-khoe/6-nguyen-tac-vang-cho-suc-khoe-nguoi-cao-tuoi-1387651688.htm
"trưng bày, bán tranh sơn dầu chung tay vì người cao tuổi",https://dantri.com.vn/giai-tri/trung-bay-ban-tranh-son-dau-chung-tay-vi-nguoi-cao-tuoi-1389914885.htm
"người cao tuổi hàn quốc như được ""sống lại lần nữa"" nhờ vắc xin covid-19",https://dantri.com.vn/the-gioi/nguoi-cao-tuoi-han-quoc-nhu-duoc-song-lai-lan-nua-nho-vac-xin-covid19-20210617211505050.htm
pv gas hưởng ứng “tháng hành động vì người cao tuổi việt nam”,https://dantri.com.vn/doanh-nghiep/pv-gas-huong-ung-thang-hanh-dong-vi-nguoi-cao-tuoi-viet-nam-20171026145726665.htm
cần lắm hoạt động khám sức khỏe cho người cao tuổi,https://dantri.com.vn/tu-van/can-lam-hoat-dong-kham-suc-khoe-cho-nguoi-cao-tuoi-1350757075.htm
đừng bỏ phí kinh nghiệm và giá trị to lớn của đội ngũ người cao tuổi!,https://dantri.com.vn/xa-hoi/dung-bo-phi-kinh-nghiem-va-gia-tri-to-lon-cua-doi-ngu-nguoi-cao-tuoi-20201001090113513.htm
kingsport ký dự thảo tài trợ quỹ chăm sóc và phát huy vai trò người cao tuổi việt nam,https://dantri.com.vn/doi-song/kingsport-ky-du-thao-tai-tro-quy-cham-soc-va-phat-huy-vai-tro-nguoi-cao-tuoi-viet-nam-20230818090205463.htm
khám sức khỏe miễn phí cho người cao tuổi tại bệnh viện an sinh,https://dantri.com.vn/doi-song/kham-suc-khoe-mien-phi-cho-nguoi-cao-tuoi-tai-benh-vien-an-sinh-20160926171037689.htm
vinparents - món quà sức khoẻ dành cho người cao tuổi,https://dantri.com.vn/tu-van/vinparents-mon-qua-suc-khoe-danh-cho-nguoi-cao-tuoi-1354443512.htm
"""đi từng ngõ, gõ từng nhà"" tiêm vét cho người cao tuổi, có bệnh lý nền",https://dantri.com.vn/suc-khoe/di-tung-ngo-go-tung-nha-tiem-vet-cho-nguoi-cao-tuoi-co-benh-ly-nen-20211206203454096.htm
đến ngày hội người cao tuổi sẽ được khám sức khỏe miễn phí,https://dantri.com.vn/doi-song/den-ngay-hoi-nguoi-cao-tuoi-se-duoc-kham-suc-khoe-mien-phi-20180608102600322.htm
đến lượt air mekong giảm giá vé cho người cao tuổi,https://dantri.com.vn/thi-truong/den-luot-air-mekong-giam-gia-ve-cho-nguoi-cao-tuoi-1313975123.htm
những điều cần biết về chăm sóc sức khỏe người cao tuổi,https://dantri.com.vn/khoa-hoc/nhung-dieu-can-biet-ve-cham-soc-suc-khoe-nguoi-cao-tuoi-20160704112809189.htm
chủ động tài chính của người cao tuổi,https://dantri.com.vn/kinh-doanh/chu-dong-tai-chinh-cua-nguoi-cao-tuoi-20160604095225907.htm
những dưỡng chất giúp củng cố hệ xương của người cao tuổi,https://dantri.com.vn/suc-khoe/nhung-duong-chat-giup-cung-co-he-xuong-cua-nguoi-cao-tuoi-20151226122734302.htm
vinamilk chăm sóc sức khỏe cho người cao tuổi tiền giang,https://dantri.com.vn/doanh-nghiep/vinamilk-cham-soc-suc-khoe-cho-nguoi-cao-tuoi-tien-giang-1371716211.htm
62% người cao tuổi vn chưa có lương hưu hoặc trợ cấp tuổi già,https://dantri.com.vn/lao-dong-viec-lam/62-nguoi-cao-tuoi-vn-chua-co-luong-huu-hoac-tro-cap-tuoi-gia-20150909100344502.htm
ngô phương lan cổ vũ người cao tuổi luyện tập thể thao,https://dantri.com.vn/giai-tri/ngo-phuong-lan-co-vu-nguoi-cao-tuoi-luyen-tap-the-thao-1401636324.htm
"xử lý ngay 4 nguyên nhân này, người cao tuổi không lo ho làm phiền",https://dantri.com.vn/suc-khoe/xu-ly-ngay-4-nguyen-nhan-nay-nguoi-cao-tuoi-khong-lo-ho-lam-phien-20190218010049541.htm
khởi phát bệnh parkinson ở người trẻ có gì khác với người cao tuổi?,https://dantri.com.vn/suc-khoe/khoi-phat-benh-parkinson-o-nguoi-tre-co-gi-khac-voi-nguoi-cao-tuoi-20190121171214156.htm
hiểm họa từ nhiệt độ 32 độ c với người cao tuổi,https://dantri.com.vn/suc-khoe/hiem-hoa-tu-nhiet-do-32-do-c-voi-nguoi-cao-tuoi-1433210466.htm
vinamilk hỗ trợ tư vấn dinh dưỡng và sức khỏe cho hơn 2.100 người cao tuổi,https://dantri.com.vn/tu-van/vinamilk-ho-tro-tu-van-dinh-duong-va-suc-khoe-cho-hon-2-100-nguoi-cao-tuoi-20160302120050158.htm
“nhà nước có rất nhiều chính sách tôn vinh người cao tuổi”,https://dantri.com.vn/xa-hoi/nha-nuoc-co-rat-nhieu-chinh-sach-ton-vinh-nguoi-cao-tuoi-1394188562.htm
người cao tuổi có được cấp lại giấy khai sinh không?,https://dantri.com.vn/ban-doc/nguoi-cao-tuoi-co-duoc-cap-lai-giay-khai-sinh-khong-20210909085829281.htm
"3 mẹo trị ho đêm chuẩn cho người cao tuổi, cứ làm theo là đỡ",https://dantri.com.vn/suc-khoe/3-meo-tri-ho-dem-chuan-cho-nguoi-cao-tuoi-cu-lam-theo-la-do-20190314105708877.htm
khám phá điểm nghỉ dưỡng nâng tầm cuộc sống dành cho người cao tuổi,https://dantri.com.vn/kinh-doanh/kham-pha-diem-nghi-duong-nang-tam-cuoc-song-danh-cho-nguoi-cao-tuoi-20171214124541474.htm
vinamilk tư vấn chăm sóc sức khoẻ cho người cao tuổi hà tĩnh,https://dantri.com.vn/doanh-nghiep/vinamilk-tu-van-cham-soc-suc-khoe-cho-nguoi-cao-tuoi-ha-tinh-1360102738.htm
hà nội: đình chỉ phụ xe buýt “hành” người cao tuổi không có thẻ miễn phí,https://dantri.com.vn/xa-hoi/ha-noi-dinh-chi-phu-xe-buyt-hanh-nguoi-cao-tuoi-khong-co-the-mien-phi-20191115105535547.htm
mở ra câu chuyện dài về vấn đề quan tâm người cao tuổi,https://dantri.com.vn/tu-van/mo-ra-cau-chuyen-dai-ve-van-de-quan-tam-nguoi-cao-tuoi-1318804884.htm
vinamilk tư vấn chăm sóc sức khoẻ cho người cao tuổi khánh hoà,https://dantri.com.vn/doanh-nghiep/vinamilk-tu-van-cham-soc-suc-khoe-cho-nguoi-cao-tuoi-khanh-hoa-1359675728.htm
tphcm: người cao tuổi nhất ứng cử là 74 tuổi,https://dantri.com.vn/xa-hoi/tphcm-nguoi-cao-tuoi-nhat-ung-cu-la-74-tuoi-1301022467.htm
tìm ra loại vi-rút có thể giúp tăng cường miễn dịch cho người cao tuổi,https://dantri.com.vn/khoa-hoc/tim-ra-loai-vi-rut-co-the-giup-tang-cuong-mien-dich-cho-nguoi-cao-tuoi-20180705142127647.htm
ô nhiễm không khí dẫn đến nguy cơ tử vong sớm ở người cao tuổi,https://dantri.com.vn/khoa-hoc/o-nhiem-khong-khi-dan-den-nguy-co-tu-vong-som-o-nguoi-cao-tuoi-20171231074858425.htm
"kingsport mang ""vu lan hạnh phúc"" đến với những người cao tuổi neo đơn tại các viện dưỡng lão",https://dantri.com.vn/doi-song/kingsport-mang-vu-lan-hanh-phuc-den-voi-nhung-nguoi-cao-tuoi-neo-don-tai-cac-vien-duong-lao-20220819155936006.htm
"lohha trí não giúp gì cho người cao tuổi bị teo não, sa sút trí tuệ?",https://dantri.com.vn/suc-khoe/lohha-tri-nao-giup-gi-cho-nguoi-cao-tuoi-bi-teo-nao-sa-sut-tri-tue-20190807065054809.htm
ung thư ở người cao tuổi - đừng từ bỏ cơ hội!,https://dantri.com.vn/suc-khoe/ung-thu-o-nguoi-cao-tuoi-dung-tu-bo-co-hoi-20200724002136908.htm
nhung hươu hỗ trợ sức khỏe người cao tuổi như thế nào?,https://dantri.com.vn/suc-khoe/nhung-huou-ho-tro-suc-khoe-nguoi-cao-tuoi-nhu-the-nao-1412623212.htm
"gần 400 người cao tuổi được chăm sóc sức khoẻ, tư vấn dinh dưỡng",https://dantri.com.vn/doi-song/gan-400-nguoi-cao-tuoi-duoc-cham-soc-suc-khoe-tu-van-dinh-duong-20170607150303995.htm
5 căn bệnh nhiều người cao tuổi dễ mắc,https://dantri.com.vn/tu-van/5-can-benh-nhieu-nguoi-cao-tuoi-de-mac-20161101151016287.htm
chấn động vụ người cao tuổi bị bỏ mặc đến chết trong nhà dưỡng lão ở canada,https://dantri.com.vn/the-gioi/chan-dong-vu-nguoi-cao-tuoi-bi-bo-mac-den-chet-trong-nha-duong-lao-o-canada-20200418142423544.htm
thiết bị thông minh ezviz: cách giúp người cao tuổi sống an nhiên,https://dantri.com.vn/doi-song/thiet-bi-thong-minh-ezviz-cach-giup-nguoi-cao-tuoi-song-an-nhien-20231108073112326.htm
​vinamilk đồng hành tổ chức lễ mừng thọ & chăm sóc sức khỏe cho gần 1.000 người cao tuổi,https://dantri.com.vn/doi-song/vinamilk-dong-hanh-to-chuc-le-mung-tho-cham-soc-suc-khoe-cho-gan-1000-nguoi-cao-tuoi-20171005075219982.htm
tăng cường sức đề kháng cho người cao tuổi - những điều cần lưu ý,https://dantri.com.vn/doi-song/tang-cuong-suc-de-khang-cho-nguoi-cao-tuoi-nhung-dieu-can-luu-y-20161017160620706.htm
3 lưu ý quan trọng trong việc chăm sóc răng miệng ở người cao tuổi,https://dantri.com.vn/suc-khoe/3-luu-y-quan-trong-trong-viec-cham-soc-rang-mieng-o-nguoi-cao-tuoi-20160803091321447.htm
những dược thảo tốt cho gan người cao tuổi,https://dantri.com.vn/suc-khoe/nhung-duoc-thao-tot-cho-gan-nguoi-cao-tuoi-2015122509324189.htm
giải pháp cho tình trạng táo bón ở người cao tuổi,https://dantri.com.vn/tu-van/giai-phap-cho-tinh-trang-tao-bon-o-nguoi-cao-tuoi-1304121031.htm
"vinamilk chăm sóc sức khoẻ người cao tuổi nghệ an, thanh hóa",https://dantri.com.vn/doanh-nghiep/vinamilk-cham-soc-suc-khoe-nguoi-cao-tuoi-nghe-an-thanh-hoa-1376243123.htm
nguyễn thị trà dạy hát tiếng việt cho người cao tuổi nhật bản,https://dantri.com.vn/video/nguyen-thi-tra-day-hat-tieng-viet-cho-nguoi-cao-tuoi-nhat-ban-169764.htm
tổ chức lễ mừng thọ và chăm sóc sức khỏe cho 1.000 người cao tuổi tại tphcm,https://dantri.com.vn/doi-song/to-chuc-le-mung-tho-va-cham-soc-suc-khoe-cho-1000-nguoi-cao-tuoi-tai-tphcm-20160929212650786.htm
người cao tuổi hà nội chỉ cần xuất trình chứng minh thư để đi xe buýt miễn phí,https://dantri.com.vn/xa-hoi/nguoi-cao-tuoi-ha-noi-chi-can-xuat-trinh-chung-minh-thu-de-di-xe-buyt-mien-phi-20190910152214585.htm
10 nguyên tắc ăn uống lành mạnh cho người cao tuổi,https://dantri.com.vn/suc-khoe/10-nguyen-tac-an-uong-lanh-manh-cho-nguoi-cao-tuoi-1302282180.htm
cảnh giác với biểu hiện đau bụng ở người cao tuổi,https://dantri.com.vn/suc-khoe/canh-giac-voi-bieu-hien-dau-bung-o-nguoi-cao-tuoi-20190830115029997.htm
thành lập quỹ chăm sóc người cao tuổi việt nam,https://dantri.com.vn/xa-hoi/thanh-lap-quy-cham-soc-nguoi-cao-tuoi-viet-nam-1159070177.htm
vinamilk tư vấn chăm sóc sức khoẻ cho người cao tuổi đồng nai,https://dantri.com.vn/doanh-nghiep/vinamilk-tu-van-cham-soc-suc-khoe-cho-nguoi-cao-tuoi-dong-nai-1384007865.htm
xác lập kỷ lục “đồng diễn thể dục dưỡng sinh với 5000 người cao tuổi”,https://dantri.com.vn/the-thao/xac-lap-ky-luc-dong-dien-the-duc-duong-sinh-voi-5000-nguoi-cao-tuoi-20170318214817911.htm
vinamilk tư vấn chăm sóc sức khoẻ cho người cao tuổi kiên giang,https://dantri.com.vn/doanh-nghiep/vinamilk-tu-van-cham-soc-suc-khoe-cho-nguoi-cao-tuoi-kien-giang-1382879174.htm
ngày hội sức khỏe người cao tuổi “sống độc lập - sống khỏe vui” thành công rực rỡ.,https://dantri.com.vn/tu-van/ngay-hoi-suc-khoe-nguoi-cao-tuoi-song-doc-lap-song-khoe-vui-thanh-cong-ruc-ro-20161003111544577.htm
vinamilk tư vấn chăm sóc sức khoẻ người cao tuổi tp móng cái,https://dantri.com.vn/doanh-nghiep/vinamilk-tu-van-cham-soc-suc-khoe-nguoi-cao-tuoi-tp-mong-cai-1387906178.htm
giải pháp quan trọng cho người cao tuổi nằm liệt,https://dantri.com.vn/suc-khoe/giai-phap-quan-trong-cho-nguoi-cao-tuoi-nam-liet-20171021212402371.htm
đồng hồ thông minh tích hợp 3g và gps đặc biệt dành cho người cao tuổi,https://dantri.com.vn/cong-nghe/dong-ho-thong-minh-tich-hop-3g-va-gps-dac-biet-danh-cho-nguoi-cao-tuoi-20160521074308999.htm
chính thức có ngày truyền thống người cao tuổi,https://dantri.com.vn/xa-hoi/chinh-thuc-co-ngay-truyen-thong-nguoi-cao-tuoi-1149198884.htm
đặc quyền dành riêng cho cư dân nhí và người cao tuổi tại 6th element,https://dantri.com.vn/nha-dat/dac-quyen-danh-rieng-cho-cu-dan-nhi-va-nguoi-cao-tuoi-tai-6th-element-20180531104137886.htm
"giải pháp nhỏ, thay đổi lớn cho người cao tuổi suy dinh dưỡng",https://dantri.com.vn/suc-khoe/giai-phap-nho-thay-doi-lon-cho-nguoi-cao-tuoi-suy-dinh-duong-20220106142122963.htm
hội khuyến học đồng hành cùng hội người cao tuổi trong phong trào học tập suốt đời,https://dantri.com.vn/giao-duc/hoi-khuyen-hoc-dong-hanh-cung-hoi-nguoi-cao-tuoi-trong-phong-trao-hoc-tap-suot-doi-20180118092724416.htm
tăng chuẩn trợ cấp đối với người cao tuổi lên 180.000 đồng,https://dantri.com.vn/kinh-doanh/tang-chuan-tro-cap-doi-voi-nguoi-cao-tuoi-len-180000-dong-1295710242.htm
đình chỉ vụ án đối với cựu tổng biên tập báo người cao tuổi kim quốc hoa,https://dantri.com.vn/phap-luat/dinh-chi-vu-an-doi-voi-cuu-tong-bien-tap-bao-nguoi-cao-tuoi-kim-quoc-hoa-20161222223504447.htm
"người cao tuổi, khuyết tật ở tp thủ đức được làm cccd tại nhà",https://dantri.com.vn/xa-hoi/nguoi-cao-tuoi-khuyet-tat-o-tp-thu-duc-duoc-lam-cccd-tai-nha-20230527174828916.htm
ngày quốc tế người cao tuổi (1/10): “để không ai cô đơn trong tuổi già”,https://dantri.com.vn/lao-dong-viec-lam/ngay-quoc-te-nguoi-cao-tuoi-110-de-khong-ai-co-don-trong-tuoi-gia-20160930080303693.htm
hơn 1.000 người cao tuổi tìm hiểu luật bảo vệ người tiêu dùng cùng vinamilk,https://dantri.com.vn/thi-truong/hon-1000-nguoi-cao-tuoi-tim-hieu-luat-bao-ve-nguoi-tieu-dung-cung-vinamilk-1436540892.htm
vệ sinh theo cách nhật bản cho người cao tuổi,https://dantri.com.vn/suc-khoe/ve-sinh-theo-cach-nhat-ban-cho-nguoi-cao-tuoi-1422982884.htm
trường đại học dành cho người cao tuổi ở anh,https://dantri.com.vn/doi-song/truong-dai-hoc-danh-cho-nguoi-cao-tuoi-o-anh-1432006648.htm
sẽ tăng mức trợ cấp cho người cao tuổi,https://dantri.com.vn/xa-hoi/se-tang-muc-tro-cap-cho-nguoi-cao-tuoi-1147536458.htm
huyết sâm - dược thảo cho người cao tuổi thiếu máu,https://dantri.com.vn/suc-khoe/huyet-sam-duoc-thao-cho-nguoi-cao-tuoi-thieu-mau-1421817609.htm
người cao tuổi có được đóng bhxh tự nguyện để hưởng lương hưu?,https://dantri.com.vn/lao-dong-viec-lam/nguoi-cao-tuoi-co-duoc-dong-bhxh-tu-nguyen-de-huong-luong-huu-20201122231521933.htm
ăn ngủ ngon bách linh: “cứu cánh” của người cao tuổi,https://dantri.com.vn/tu-van/an-ngu-ngon-bach-linh-cuu-canh-cua-nguoi-cao-tuoi-20160617111804229.htm
bổ sung liệu pháp cười vào các hoạt động thể chất sẽ tốt cho người cao tuổi,https://dantri.com.vn/khoa-hoc/bo-sung-lieu-phap-cuoi-vao-cac-hoat-dong-the-chat-se-tot-cho-nguoi-cao-tuoi-20160925054239101.htm
duyên dáng áo dài tphcm: người cao tuổi nhất từng tham gia là 85 tuổi,https://dantri.com.vn/giai-tri/duyen-dang-ao-dai-tphcm-nguoi-cao-tuoi-nhat-tung-tham-gia-la-85-tuoi-20240310220545907.htm
"phương pháp ""chăm sóc điều dưỡng hỗ trợ tự lập"" dành cho người cao tuổi",https://dantri.com.vn/giao-duc/phuong-phap-cham-soc-dieu-duong-ho-tro-tu-lap-danh-cho-nguoi-cao-tuoi-20230915174930713.htm
nỗi lo của trung quốc khi dự kiến có thêm 100 triệu người cao tuổi,https://dantri.com.vn/the-gioi/noi-lo-cua-trung-quoc-khi-du-kien-co-them-100-trieu-nguoi-cao-tuoi-20230817173132280.htm
"thăm ""ngôi nhà chung"" giúp những người cao tuổi tìm lại nụ cười",https://dantri.com.vn/lao-dong-viec-lam/tham-ngoi-nha-chung-giup-nhung-nguoi-cao-tuoi-tim-lai-nu-cuoi-20200814081052403.htm
vì sao nhiều người cao tuổi vẫn giữ được sự minh mẫn?,https://dantri.com.vn/khoa-hoc/vi-sao-nhieu-nguoi-cao-tuoi-van-giu-duoc-su-minh-man-20171108064540134.htm
geego sure đẩy lùi bệnh thoái hóa hoàng điểm mắt ở người cao tuổi,https://dantri.com.vn/tu-van/geego-sure-day-lui-benh-thoai-hoa-hoang-diem-mat-o-nguoi-cao-tuoi-1349020409.htm
dược phẩm nhất nhất đạt kỷ lục vn “hành trình vì sức khỏe người cao tuổi”,https://dantri.com.vn/doanh-nghiep/duoc-pham-nhat-nhat-dat-ky-luc-vn-hanh-trinh-vi-suc-khoe-nguoi-cao-tuoi-1412968143.htm
lợi ích tuyệt vời của ghế massage với sức khỏe người cao tuổi,https://dantri.com.vn/suc-khoe/loi-ich-tuyet-voi-cua-ghe-massage-voi-suc-khoe-nguoi-cao-tuoi-20190821145624313.htm
vinamilk chung tay nâng cao chất lượng cuộc sống cho người cao tuổi miền bắc,https://dantri.com.vn/doanh-nghiep/vinamilk-chung-tay-nang-cao-chat-luong-cuoc-song-cho-nguoi-cao-tuoi-mien-bac-1370928977.htm
