link,data
https://vietcetera.com/vn/silver-economy-khi-nguoi-cao-tuoi-ap-dao-thi-truong,"Silver economy - Khi người cao tuổi “áp đảo” thị trường Nguồn: Nikkei Asia Bức tranh kinh tế của một quốc gia là tổng hòa của nhiều nền kinh tế nhỏ mang những “sắc màu” đặc trưng như nền kinh tế vỉa hè, nền kinh tế độc thân… Trong đó, nền kinh tế bạc (silver economy) là một gam màu đang ngày càng rõ rệt trên bức tranh ấy theo từng tháng năm. Vậy nền kinh tế bạc là gì, và nó có ảnh hưởng như thế nào đến xu hướng phát triển kinh tế quốc gia trong tương lai? 1. Silver economy là gì? Nền kinh tế bạc, theo báo cáo của Ủy ban Châu Âu, là tổng hợp tất cả các hoạt động kinh tế phục vụ nhu cầu của những người từ 50 tuổi trở lên (bao gồm việc mua bán các sản phẩm, dịch vụ và các hoạt động kinh tế khác sinh ra từ giao dịch này). Nếu xét theo thời điểm bài viết được đăng tải (năm 2024), những người có năm sinh từ 1974 trở về trước sẽ được tính vào thành phần chính của nền kinh tế bạc. Nền kinh tế bạc trải rộng ra khá nhiều phân khúc. Không chỉ gói gọn ở chăm sóc sức khỏe, hay dưỡng lão, mà nó còn bao gồm công nghệ thông tin, tài chính, bất động sản, giao thông vận tải, năng lượng, thực phẩm, du lịch, văn hóa, cơ sở hạ tầng và dịch vụ địa phương. 2. Nguồn gốc silver economy? Theo Nikkei, tên gọi “nền kinh tế bạc” bắt nguồn từ Nhật Bản vào những năm 1970 của thế kỷ XX. Không bất ngờ khi khái niệm này đến từ Nhật Bản - quốc gia đã có tỷ lệ dân số già luôn dẫn đầu thế giới. Dù chính phủ đã có nhiều nỗ lực, song tỷ lệ sinh tại quốc gia này vẫn không ngừng suy giảm, khiến Nhật Bản trở thành nước “siêu già” (tỷ lệ người trên 65 tuổi lớn hơn 20% dân số) năm 2006. Giáo sư Zhou Weisheng (giám đốc Viện Nghiên cứu Toàn cầu 3E, Nhật Bản) nhận xét trong bối cảnh như vậy, tất cả ngành công nghiệp sản xuất, dịch vụ tại đây đều buộc phải xem nhóm người cao tuổi là khách hàng tiềm năng. Ví dụ khuôn viên nhà ở không có rào chắn, thuận tiện cho xe lăn và gậy chống đã được áp dụng cho mọi phân khúc nhà, dù nó từng là điểm cạnh tranh ưu việt của phân khúc cao cấp. Với thâm niên xây dựng nền kinh tế bạc dày dặn, Nhật Bản chính là tấm gương cho các quốc gia chuẩn bị bước vào giai đoạn dân số già, trong đó có Việt Nam. 3. Vì sao silver economy phổ biến? Tại cuộc thi Hoa hậu Hoàn vũ Hàn Quốc 2024 hồi tháng 9, thí sinh Choi Soon-hwa gây chú ý vì đi thi hoa hậu khi đã… 81 tuổi. Vốn đã có kinh nghiệm làm người mẫu từ năm 70 tuổi, nên dù đi thi cùng các cô gái bằng tuổi cháu mình, bà Choi vẫn hết sức tự tin và được công chúng Hàn ủng hộ nhiệt tình. Được biết ban tổ chức Hoa hậu Hoàn vũ Hàn Quốc đã loại bỏ giới hạn tuổi tối đa cho thí sinh từ năm 2023. Bước đi này cho thấy ngành giải trí Hàn đang nghiêm túc cân nhắc đầu tư vào nhóm người cao tuổi, và họ có thể sẽ chiếm phần không nhỏ trong “làn sóng Hallyu” tiếp theo. “Nền kinh tế bạc” vì vậy cũng trở thành đề tài được bàn luận rộng rãi trên truyền thông Hàn Quốc và nhiều nước châu Á. Ngay tại Việt Nam, quá trình già hóa dân số đã bắt đầu từ năm 2015. Hiện nước ta xếp thứ 3 Đông Nam Á về số lượng người cao tuổi, chỉ sau Thái Lan và Singapore, và được dự báo sẽ có cơ cấu dân số già vào năm 2035. Trong bối cảnh như vậy, nền kinh tế bạc có khá nhiều tiềm năng để phát triển tại Việt Nam vì: Theo nhà sáng lập Aging Asia Janice Chia, thế hệ baby boomer (sinh từ 1946 - 1964) sẽ là phân khúc khách hàng chính của các doanh nghiệp trong 1-2 thập kỷ tới. Nếu biết tận dụng và nắm bắt thời cơ, nền kinh tế bạc sẽ trở thành “gà đẻ trứng vàng” cho quốc gia. Về cốt lõi, ý nghĩa của nền kinh tế bạc không đơn thuần chỉ là phát triển kinh tế. Theo tiến sĩ Đoàn Văn Bình - Phó Chủ tịch Hiệp hội Bất động sản Việt Nam, nền kinh tế bạc là sự công nhận đóng góp của người cao tuổi cho xã hội và tiềm năng của họ với tư cách là người tiêu dùng, thay vì xem họ là gánh nặng kinh tế. 4. Cách dùng silver economy? Tiếng Anh A: Have you watched this year’s Miss Korea? They lifted the age limit so there was an 81-year-old contestant! B: I have heard about that. The silver economy will really become the next big thing.  Tiếng Việt A: Cậu có xem Hoa hậu Hàn Quốc năm nay không? Họ bỏ giới hạn tuổi đăng ký, nên có bà cụ 81 tuổi rồi vẫn đi thi đó! B: Mình có nghe nói. Đúng là “nền kinh tế bạc” sẽ trở thành cốt yếu trong thời gian tới.  Góc nhìn đa chiều về Việt Nam hiện đại. Về chúng tôi"
https://vtv.vn/goc-doanh-nghiep/co-hoi-trong-nen-kinh-te-bac-20241011162213178.htm,"TIN TỨC  Chính trị Xã hội Pháp luật Tin Thế Giới Tin tức Thế giới đó đây Câu chuyện quốc tế Kinh Tế  Bất động sản Tài chính Thị trường Góc doanh nghiệp VTV Truyền Hình  Phim VTV Hậu trường Nhân vật Góc khán giả Giải Sao Mai Người Việt bốn phương  Góc khán giả  ĐỜI SỐNG Văn Hóa - Giải Trí  Điện ảnh Âm nhạc Đời sống Du lịch Làm đẹp Chất lượng cuộc sống Sức khỏe Tấm lòng Việt  THỂ THAO Bóng đá Việt Nam Bóng đá quốc tế Quần vợt Video Các môn khác Bên lề CHƯƠNG TRÌNH ĐẶC SẮC Sự kiện & bình luận Toàn cảnh thế giới Tạp chí kinh tế cuối tuần Giao lưu trực tuyến Lịch phát sóng Magazine KHÁC Công Nghệ  Sản phẩm Thị trường Tư vấn Hitech Công nghệ tương lai Giáo Dục  Tư vấn Học trực tuyến VTV8 Liên hệ tòa soạn Bất động sản Đăng nhập Đăng ký Cơ hội trong nền “kinh tế bạc” PV-Thứ ba, ngày 15/10/2024 08:00 GMT+7 VTV.vn - Bắt nguồn từ thuật ngữ ""thị trường bạc"" xuất hiện ở Nhật Bản, quốc gia có tỷ lệ người trên 65 tuổi cao nhất trong những năm 1970… Nền kinh tế bạc dùng để chỉ thị trường cho người cao tuổi thị trường với nhu cầu đa dạng lĩnh vực chăm sóc sức khỏe, nhà ở, ngân hàng, ô tô, năng lượng, nhà ở, viễn thông, giải trí và du lịch,... Xu hướng toàn cầu Cùng với sự già hóa dân số, nền kinh tế bạc ngày càng nhận được sự quan tâm của các quốc gia. Trong một báo cáo công bố vào đầu năm 2023, Ủy ban các vấn đề kinh tế và xã hội của Liên hợp quốc xác định ""già hóa dân số"" là một xu hướng mang tính toàn cầu. Con người sống lâu hơn nhờ những bước tiến vượt bậc về y tế, điều trị y khoa, tiếp cận giáo dục và giảm tỷ lệ sinh.  Ước tính thế giới hiện có trên 761 triệu người từ 65 tuổi trở lên, con số này dự kiến tăng lên 1,6 tỷ người vào năm 2050. Số người từ 80 tuổi trở lên trên thế giới cũng tăng nhanh chóng. Khi tuổi tác tăng lên, nhu cầu về sức khỏe thể chất, chăm sóc hàng ngày và chăm sóc dài hạn của người cao tuổi cũng tăng lên đáng kể. Khu vực Châu Á-Thái Bình Dương dự kiến sẽ chứng kiến tăng trưởng nhanh nhất trong nền kinh tế bạc, do tốc độ già hóa dân số nhanh chóng ở các quốc gia như Nhật Bản, Trung Quốc và Hàn Quốc. Ở châu Âu, nền kinh tế bạc chiếm khoảng 25% GDP, với những quốc gia như Ý và Đức có tỷ lệ dân số cao tuổi đặc biệt cao.  Tại Việt Nam,  sẽ chỉ mất 18 năm để chuyển từ già hóa sang xã hội già vào năm 2036 (Theo Ủy ban Kinh tế - Xã hội châu Á - Thái Bình Dương của Liên hợp quốc). Khoảng thời gian này ngắn hơn đáng kể so với các nước trong khu vực như Thái Lan, Malaysia hay Nhật Bản. Giai đoạn già hóa dân số ở Việt Nam bắt đầu từ năm 2011 với số người cao tuổi (từ 65 tuổi trở lên) chiếm 7% tổng dân số. Theo dự báo, số người cao tuổi của Việt Nam sẽ là 16,8 triệu người vào năm 2039 và đạt 25,2 triệu người vào năm 2069.   Mở ra cơ hội hấp dẫn Nền kinh tế bạc tạo ra cơ hội đầu tư, phát triển cho nhiều lĩnh vực: Có thể kể đến: Chăm sóc sức khỏe (Dịch vụ y tế, điều dưỡng, dịch vụ chăm sóc tại nhà, và các sản phẩm, thiết bị y tế đặc thù cho người cao tuổi); bất động sản (nhà ở, nghỉ dưỡng, các trung tâm chăm sóc dài hạn, các khu nghỉ dưỡng thân thiện với người cao tuổi;...); vui chơi giải trí (Du lịch, hoạt động giải trí, sự kiện văn hóa và nghệ thuật, thể thao, các câu lạc bộ xã hội…); Thực phẩm và dinh dưỡng (Sản phẩm thực phẩm, thực phẩm chức năng được thiết kế riêng để đáp ứng nhu cầu dinh dưỡng của người cao tuổi); Dịch vụ tài chính (Bảo hiểm y tế, bảo hiểm chăm sóc điều dưỡng, tiết kiệm hưu trí, tư vấn tài chính cá nhân và đầu tư, quản lý tài sản cho người cao tuổi,..);... Một yếu tố cần quan tâm là sức khỏe của nhóm người cao tuổi ở Việt Nam. Thống kê của Tổng cục Dân số - Kế hoạch hóa gia đình cho thấy tuổi thọ bình quân của người Việt Nam tăng nhưng số năm sống khỏe mạnh thấp so với nhiều nước. Số năm phụ nữ sống có bệnh tật trung bình khoảng 11 năm và nam giới khoảng 8 năm. Người cao tuổi đối diện với gánh nặng ""bệnh tật kép"" và thường mắc các bệnh mạn tính như mạch vành, tăng huyết áp, tiểu đường, thoái hóa khớp, ung thư…  Mặt khác, mỗi nhóm người cao tuổi ở các độ tuổi khác nhau lại có những nhu cầu riêng. Người mới nghỉ hưu hưởng nhiều tới đời sống cộng đồng, văn hóa và giải trí, nhóm người cao tuổi hơn hưởng nhiều tới chăm sóc sức khỏe và nhóm người rất cao tuổi hướng tới chăm sóc sức khỏe, sự an nhàn và tiện nghi trong cuộc sống.  Vì thế, chăm sóc sức khỏe và các lĩnh vực liên quan được xem là cơ hội vàng để đầu tư phát triển tầm nhìn trung và dài hạn, bất động sản chăm sóc sức khỏe tích hợp tiện ích nghỉ dưỡng, vui chơi giải trí được đánh giá là lĩnh vực đầy tiềm năng.  Trong số những nguồn tài nguyên được khai thác cho cơ hội này, phải kể đến nghỉ dưỡng khoáng nóng với tác dụng tuyệt vời cho sức khỏe. Tắm khoáng (Onsen) được xem là bí quyết giúp gìn giữ sự tươi trẻ, sức khỏe, giúp người Nhật có tuổi thọ trung bình cao hàng đầu thế giới. Tại Việt Nam, không phải khu vực nào cũng sở hữu mỏ khoáng nóng tự nhiên với chất lượng tuyệt hảo. Sự quý hiếm cùng nhiều giá trị giúp biệt thự khoáng nóng sở hữu sở hữu tiềm năng tăng giá vượt trội và dòng tiền hấp dẫn từ vận hành kinh doanh phòng nghỉ. Đặc biệt là dòng biệt thự được nằm trong quần thể dự án với hệ thống tiện ích cao cấp, đáp ứng đa dạng nhu cầu của ""thị trường bạc"" từ chăm sóc sức khỏe đến vui chơi giải trí, kết nối bạn bè, gắn kết với con cháu,... Đây cũng là lý do dòng biệt thự khoáng nóng tự nhiên Tokyu Retreat đang được nhiều nhà đầu tư lựa chọn.  Quần thể biệt thự khoáng nóng tự nhiên Tokyu Retreat Cách Hà Nội 60 phút di chuyển, Tokyu Retreat mang đến không gian như một ngôi nhà an dưỡng tuyệt hảo cho ""thị trường bạc"" với khuôn viên Home Spa tại gia - bể ngâm khoáng, bể bơi khoáng nóng bốn mùa, khu xông nóng, lạnh,... Không gian tuyệt hảo cho những trải nghiệm nghỉ dưỡng tận hưởng khoảng thời gian thảnh thơi tuyệt vời. Thông tin chi tiết dự án Tokyu Retreat - Biệt thự khoáng nóng tự nhiên Private Onsen vui lòng liên hệ: Đơn vị tư vấn phát triển dự án MSH Group: Hotline: 0963.033.999  * Mời quý độc giả theo dõi các chương trình đã phát sóng của Đài Truyền hình Việt Nam trên TV Online và VTVGo! Từ khóa: Cùng chuyên mục Hà Nội đề nghị công an xử lý “cò” nhà ở xã hội VTV.vn - Sở Xây dựng Hà Nội đề nghị công an thành phố tăng rà soát, xử lý môi giới nhận khai, nộp hồ sơ mua nhà xã hội trái quy định. Quy trình mua nhà ở xã hội trực tiếp từ chủ đầu tư Đẩy nhanh tiến độ các dự án nhà ở xã hội Đề xuất đánh thuế bất động sản thứ hai: Phương... 80% lô đất trúng đấu giá tại Hà Đông bị bỏ cọc: Có... TIN MỚI TIN TỨC  Chính trị Xã hội Pháp luật Tin Thế Giới Tin tức Thế giới đó đây Câu chuyện quốc tế Kinh Tế  Bất động sản Tài chính Thị trường Góc doanh nghiệp VTV Truyền Hình  Phim VTV Hậu trường Nhân vật Góc khán giả Giải Sao Mai Người Việt bốn phương  Góc khán giả  ĐỜI SỐNG Văn Hóa - Giải Trí  Điện ảnh Âm nhạc Đời sống Du lịch Làm đẹp Chất lượng cuộc sống Sức khỏe Tấm lòng Việt  THỂ THAO Bóng đá Việt Nam Bóng đá quốc tế Quần vợt Video Các môn khác Bên lề CHƯƠNG TRÌNH ĐẶC SẮC Sự kiện & bình luận Toàn cảnh thế giới Tạp chí kinh tế cuối tuần Giao lưu trực tuyến Lịch phát sóng Magazine KHÁC Công Nghệ  Sản phẩm Thị trường Tư vấn Hitech Công nghệ tương lai Giáo Dục  Tư vấn Học trực tuyến VTV8 Liên hệ tòa soạn CỔNG THÔNG TIN VTV | LIÊN HỆ CƠ QUAN CHỦ QUẢN: ĐÀI TRUYỀN HÌNH VIỆT NAM CƠ QUAN BÁO CHÍ: THỜI BÁO VTV Giấy phép hoạt động báo in và báo điện tử số 483/GP-BTTTT cấp ngày 29/12/2023 ® Cấm sao chép dưới mọi hình thức nếu không có sự chấp thuận bằng văn bản. Ghi rõ nguồn VTV.vn khi phát hành lại thông tin từ website này. Tổng Biên tập: VŨ THANH THỦY Phó Tổng Biên tập: NGUYỄN THỊ MỸ HẠNH,PHẠM QUỐC THẮNG, NGUYỄN TRỌNG NINH Tổng đài VTV: (024) 3.8355931; (024) 3.8355932 Ðiện thoại Thời báo VTV: (024) 66897 897Email: toasoan@vtv.vn Liên hệ quảng cáo: 02473007108 ĐANG PHÁT"
