link,data
https://www.vietnamplus.vn/tao-co-hoi-de-nguoi-cao-tuoi-tham-gia-nhieu-hon-vao-hoat-dong-kinh-te-xa-hoi-post988176.vnp,"
Xã hội
 Thành phố Hồ Chí Minh trước thách thức già hóa dân số (Bài 2) 
Tạo cơ hội để người cao tuổi tham gia nhiều hơn vào hoạt động kinh tế-xã hội
 Để biến thách thức già hóa dân số thành cơ hội, TP Hồ Chí Minh cần lên kế hoạch, tính toán kỹ lưỡng để phát huy năng lực, vai trò của người cao tuổi - lực lượng được coi là “vốn quý” của đất nước. Để hạn chế mặt tiêu cực của tiến trình già hóa dân số, theo các chuyên gia, Thành phố Hồ Chí Minh cần thích ứng linh hoạt và tạo cơ hội để người cao tuổi tham gia nhiều hơn vào hoạt động kinh tế-xã hội. Điều này không chỉ giúp đảm bảo cuộc sống của người cao tuổi mà còn khẳng định vai trò, vị thế của họ đối với sự phát triển của thành phố, đất nước. Không coi người cao tuổi là gánh nặng Nghỉ hưu được 5 năm, bà Lê Thị Hường (ngụ Quận 3) bắt đầu tham gia vào đội ngũ cộng tác viên sức khỏe cộng đồng ở khu phố. Công việc của bà hằng ngày là tuyên truyền, vận động người dân phòng, chống dịch bệnh, thu thập thông tin trẻ cư trú trên địa bàn, các hoạt động y tế công cộng khác do trạm y tế phường tổ chức. “Kể từ ngày tham gia vào đội ngũ cộng tác viên, tôi bận rộn hơn nhưng rất vui. Công việc cũng không vất vả, không đòi hỏi quá nhiều kỹ năng hay sức lực. Quan trọng hơn, tôi cảm thấy mình vẫn còn có ích,” bà Hường chia sẻ. Theo Thạc sỹ Lê Văn Thành, nguyên Trưởng phòng Nghiên cứu Văn hóa-Xã hội, Viện Nghiên cứu và Phát triển Thành phố Hồ Chí Minh, hiện nay nhiều người cao tuổi đến tuổi nghỉ hưu nhưng vẫn còn khỏe mạnh, minh mẫn, có đủ kỹ năng, kinh nghiệm và trải nghiệm. Do đó, cần “tận dụng” lực lượng lao động này, giúp họ trở thành đội ngũ cộng tác viên cho các đơn vị, cơ quan trong khu vực Nhà nước và tư nhân. Theo ông Thành, việc người cao tuổi tham gia vào lực lượng lao động đã có từ lâu nhưng mới chỉ giới hạn ở một số lĩnh vực nhất định và còn mang tính tự phát, cá nhân. “Để phát huy hết vai trò, năng lực của người cao tuổi, cần phát triển việc này một cách có hệ thống, bài bản và quy chuẩn. Nếu tận dụng được đây cũng là lực lượng lao động chất lượng cao tạo ra của cải vật chất đáng kể cho nền kinh tế,” ông Thành đề xuất. Đồng quan điểm, Tiến sỹ Huỳnh Thành Lập, Trưởng Ban đại diện Hội Người cao tuổi Thành phố Hồ Chí Minh cho rằng cần thay đổi quan niệm, thái độ xã hội về già hóa dân số và người cao tuổi. “Chúng ta cần nhìn nhận người cao tuổi không phải từ góc độ những người nhận trợ cấp xã hội, là gánh nặng của xã hội mà người cao tuổi là những thành viên có đóng góp tích cực trong xã hội,” Tiến sỹ Huỳnh Thành Lập nêu quan điểm và đề xuất, sửa đổi, bổ sung Luật Người cao tuổi với tinh thần phát huy cao nhất vai trò của người cao tuổi, phù hợp, thích ứng với già hóa dân số; trong đó tạo điều kiện để người cao tuổi được tiếp tục làm việc, cống hiến theo năng lực, sức khỏe của mỗi người. Cần xem xét xây dựng một chiến lược tổng thể trung hạn nhằm bảo đảm an toàn thu nhập cho người cao tuổi, gồm cả trợ cấp xã hội và lương hưu cho họ. Riêng người cao tuổi không có lương hưu, trợ cấp xã hội, thành phố cần có chính sách tạo cơ hội việc làm, phát triển kỹ năng cho họ như một phương pháp bảo đảm thu nhập và phúc lợi. Thậm chí khuyến khích người cao tuổi tham gia khởi nghiệp, phát triển kinh doanh nhỏ bằng các hình thức như mở lớp đào tạo kỹ năng miễn phí, cho vay vốn ưu đãi… Phát triển ngành kinh tế mới thích ứng già hóa dân số Mặc dù Thành phố Hồ Chí Minh đang bước nhanh vào già hóa dân số nhưng Thạc sỹ Lê Văn Thành cho rằng các chương trình hành động vì người cao tuổi mới chỉ dừng lại ở khẩu hiệu. Nhìn sang các nước có dân số già như Nhật Bản, ông Thành nêu vấn đề phát triển ngành kinh tế mới phục vụ người cao tuổi. Bởi họ cũng có những nhu cầu riêng và cần phải thúc đẩy các ngành nghề kinh tế phục vụ nhu cầu này. Ở Nhật Bản và các quốc gia khác đã xây dựng thành công nền công nghiệp dành cho người cao tuổi với khái niệm “kinh tế bạc,” trong đó có nhiều trung tâm dịch vụ cho người cao tuổi, nghiên cứu phát triển sản phẩm dành riêng cho người già… Việt Nam nói chung và Thành phố Hồ Chí Minh nói riêng nên bắt đầu phát triển các lĩnh vực chăm sóc, phục vụ người già như dịch vụ y tế, chăm sóc sức khỏe, dụng cụ trợ giúp sinh hoạt, dụng cụ thiết yếu khác… Về vấn đề chăm sóc người cao tuổi, theo Thạc sỹ Lê Văn Thành, nên chuyển dần từ gia đình sang xã hội và rất cần chung tay của Nhà nước cũng như kêu gọi sự tham gia các nguồn lực xã hội khác. Trong đợt COVID-19 vừa qua đã bộc lộ vấn đề, nhiều người cao tuổi, nhất là người già yếu không có người chăm sóc. Trong khi đó, viện dưỡng lão vẫn là nơi đại đa số người cao tuổi chưa tiếp cận được. Hiện, Thành phố Hồ Chí Minh mới chỉ có 8 đơn vị công lập chăm sóc, nuôi dưỡng người cao tuổi lang thang, không có địa chỉ rõ ràng và 12 cơ sở tư nhân nuôi dưỡng, chăm sóc người cao tuổi có thu phí với khoảng hơn 2.600 người đang được nuôi dưỡng. Theo Tiến sỹ Huỳnh Thành Lập, Trưởng Ban đại diện Hội Người cao tuổi Thành phố Hồ Chí Minh, con số này chưa đáp ứng được nhu cầu của người cao tuổi. Tuy nhiên, rào cản lớn nhất hiện nay là để vào được các viện dưỡng lão, người cao tuổi và gia đình phải chi trả chi phí không nhỏ. Để giảm chi phí phù hợp hơn với mặt bằng chung của người cao tuổi, Thạc sỹ Lê Văn Thành cho rằng, Thành phố cần có chính sách hỗ trợ ưu đãi về thuế, mặt bằng, vay vốn… đối với đơn vị tư nhân tham gia vào dịch vụ nhà dưỡng lão. Ông cũng đề xuất thành phố nên dành quỹ đất xây dựng một khu phức hợp dành cho người cao tuổi tại huyện đảo Cần Giờ, kêu gọi sự chung tay tham gia của đơn vị tư nhân và có chính sách ưu đãi, hỗ trợ phù hợp. “Nên xem sự hỗ trợ này như là một phần trong chính sách an sinh xã hội thích ứng linh hoạt với quá trình già hóa dân số,” ông Thành nêu quan điểm. Thạc sỹ Lê Văn Thành nhìn nhận, già hóa dân số là thách thức nhưng cũng là cơ hội. Các giải pháp cần được thành phố lên kế hoạch, tính toán kỹ lưỡng làm sao vừa giảm thiểu áp lực già hóa dân số lên nền kinh tế, hệ thống an sinh xã hội vừa phát huy năng lực, vai trò của người cao tuổi - lực lượng được coi là “vốn quý” của đất nước./. Bài 1: Gia tăng áp lực lên hệ thống an sinh xã hội và y tế 
Tin liên quan
   Bảo vệ nguyên khí quốc gia trong bối cảnh già hóa dân số
  Trong bối cảnh già hóa dân số ngày càng gia tăng, việc chăm sóc sức khỏe cho người cao tuổi được cả hệ thống chính trị xác định là nhiệm vụ trọng tâm.   Già hóa dân số ở Việt Nam: Lấp khoảng trống chưa giàu đã già cho người cao tuổi
  Việt Nam là 1 trong số 10 nước có tốc độ già hóa nhanh nhất trên thế giới. Do đó, các chính sách an sinh xã hội, việc làm... đang được điều chỉnh, bổ sung để chuẩn bị cho thời kỳ dân số già.   Nghiên cứu, xây dựng các chính sách đón đầu xu hướng già hóa dân số
  Theo Phó Thủ tướng Lê Thành Long, chính sách ngày càng rõ, tương đối đầy đủ dành cho người cao tuổi nhưng các chính sách đón đầu xu hướng già hóa dân số còn chưa kịp thời, nguồn lực còn hạn chế. 

Tin cùng chuyên mục

  
 Khuyến cáo của Bộ Y tế phòng chống bệnh sởi
  Bộ Y tế khuyến cáo cần chủ động đưa trẻ từ 9 tháng-2 tuổi chưa tiêm hoặc tiêm chưa đủ 2 mũi vaccine phòng bệnh sởi đi tiêm đầy đủ, đúng lịch.   Hà Nội rút ngắn 60% thời hạn giải quyết thủ tục cho dự án lớn
  Nguyên tắc phân luồng là tập trung, khẩn trương giải quyết ngay các hồ sơ công việc theo cơ chế ưu tiên “làn xanh” nhằm rút ngắn thời gian xử lý, đảm bảo không chậm trễ, không quá hạn.   WB cam kết tiếp tục huy động nguồn viện trợ hỗ trợ Đề án 1 triệu ha lúa
  Để hỗ trợ thực hiện Đề án 1 triệu ha lúa, WB đang hỗ trợ Việt Nam tiếp cận TCAF và chuẩn bị dự án hỗ trợ hạ tầng và kỹ thuật cho sản xuất lúa chất lượng cao, phát thải thấp vay vốn WB.   Hà Nam tạo điều kiện thuận lợi nhất để Bệnh viện Bạch Mai cơ sở 2 sớm hoạt động
  Theo dự kiến, với quy mô 1.000 giường bệnh, Bệnh viện Bạch Mai cơ sở 2 tại Hà Nam sẽ  khám, chữa bệnh cho 20 triệu người dân từ khu vực Hà Tĩnh trở ra, góp phần giảm tải cho cơ sở 1 tại Hà Nội.   Nhiều dự án do chính phủ Hoa Kỳ tài trợ hoạt động trở lại ở tỉnh Quảng Trị
  Một dự án sử dụng vốn ODA không hoàn lại do USAID tài trợ đã hoạt động trở lại là “Hỗ trợ cải thiện chất lượng sống của người khuyết tật tại các tỉnh bị phun rải nặng chất da cam.”   TP Hồ Chí Minh: Sắp xếp quận, huyện có thể vượt khỏi giới hạn địa giới hiện hữu
  Theo ông Nguyễn Văn Được, Thành phố đang dự kiến 2 phương án sáp nhập đơn vị hành chính; trong đó có phương án “xóa” toàn bộ đơn vị hành chính hiện hữu, kể cả thành phố Thủ Đức, sau đó phân chia lại.   Hà Nội thông tin việc quy hoạch khu vực quảng trường Đông Kinh-Nghĩa Thục   Thành phố Hà Nội dự kiến sẽ giải phóng mặt bằng tòa nhà Hàm cá mập trước ngày 30/4/2025 và giải phóng mặt bằng khu vực phía Đông hồ Hoàn Kiếm trước ngày 02/9/2025.   Lời cảm ơn của Ban Lễ tang và gia đình Nhà báo lão thành Võ Thế Ái
  Lễ tang Nhà báo lão thành Võ Thế Ái, nguyên Phó Trưởng ban Ban biên tập tin Trong nước, TTXVN đã được tổ chức trang trọng tại Nhà Tang lễ Quốc gia, số 5 Trần Thánh Tông, Hà Nội, sáng 19/3/2025.   Chính phủ đề ra 8 nhóm giải pháp tiếp tục thực hiện đổi mới giáo dục   Chương trình hành động của Chính phủ đề ra 8 nhiệm vụ, giải pháp nhằm thực hiện Kết luận số 91-KL/TW ngày 4/11/ 2013 của Ban Chấp hành Trung ương Đảng về tiếp tục đổi mới căn bản, toàn diện giáo dục.   Đến năm 2030, cả nước có ít nhất 80% số xã đạt chuẩn nông thôn mới   Dự kiến đến năm 2030, cả nước có ít nhất khoảng 1.600 xã đạt chuẩn nông thôn mới theo bộ tiêu chí quốc gia giai đoạn 2026-2030; trong đó có ít nhất 560 xã đạt chuẩn nông thôn mới nâng cao.   Hợp long cầu Thanh An-Đường Hồ Chí Minh, sẽ thông xe kỹ thuật vào 30/4
  Việc hợp long cầu Thanh An trên tuyến đường Hồ Chí Minh là cột mốc quan trọng để tiến tới thông xe kỹ thuật toàn tuyến vào dịp Kỷ niệm 50 năm Giải phóng miền Nam, thống nhất đất nước (30/4/1975-2025).  
 Hà Nội dự kiến “chốt” địa điểm đặt Km0 ở vị trí nào?
  Quận Hoàn Kiếm (Hà Nội) đang chuẩn bị thực hiện dự án đầu tư cải tạo vườn hoa Lý Thái Tổ với tổng mức đầu tư sơ bộ của dự án là hơn 182 tỷ đồng từ nguồn ngân sách quận.   Chủ tịch nước chủ trì Hội nghị báo cáo kết luận kiểm tra tại Hưng Yên
  Chủ tịch nước lưu ý Tỉnh ủy, Ban Thường vụ Tỉnh ủy Hưng Yên tổ chức thực hiện tốt chủ trương sắp xếp, tổ chức bộ máy bảo đảm tinh, gọn, mạnh, hiệu năng, hiệu lực, hiệu quả.   Đắk Nông: Phát hiện thi thể người thám hiểm trong hang động núi lửa Krông Nô
  Vào khoảng 14 giờ 50 ngày 19/3, một số người dân đi làm rẫy phát hiện thi thể trên đang trong giai đoạn phân hủy tại hang động C7, thuộc địa giới hành chính thôn Nam Tân, xã Nam Đà.   Việt Nam và Trung Quốc tăng cường hợp tác tư pháp và chấp pháp   Hai bên khẳng định tầm quan trọng của việc tiếp tục phát huy vai trò của cơ chế hợp tác song phương về tư pháp và thực thi pháp luật, góp phần tạo nền tảng pháp lý vững chắc cho quan hệ song phương.   Kiên Giang: Tuyên án 28 đối tượng ẩu đả liên quan tranh chấp đất tại Phú Quốc
  Hai nhóm đối đầu tại khu vực đất tranh chấp và đã sử dụng hung khí nguy hiểm để tấn công nhau. Nhóm của Thái bus đã đánh đuổi anh Hà Thanh Liêm, chủ thầu xây dựng do nhóm Cường thuê.   Đồng thuận việc sớm đưa chữ viết Cơ Tu vào giảng dạy trong trường học
  Các nhà nghiên cứu, nhà khoa học, đại biểu đều đồng tình phải có một bộ chữ viết của người Cơ Tu thống nhất trên toàn quốc về bảng ký hiệu chữ viết, các tổ phụ âm đầu, nguyên âm…   Hà Nội chỉ đạo rút ngắn thời gian xử lý hồ sơ công việc nhằm đạt tăng trưởng 8%
  Hà Nội giao lãnh đạo các sở, ban, ngành, quận, huyện, thị xã rà soát, tinh gọn quy trình thủ tục giải quyết hồ sơ, đảm bảo thời hạn giải quyết rút ngắn ít nhất 60% so với quy định hiện hành.   Kon Tum: Kế hoạch trồng mới gần 1.600 ha sâm Ngọc Linh
  Trong số diện tích sâm Ngọc Linh dự kiến trồng trong năm 2025, có 60ha trồng trong nhân dân (huyện Đăk Glei 15ha, huyện Tu Mơ Rông 45ha); hơn 1.500ha còn lại sẽ được các doanh nghiệp trồng.   Thông điệp “Một giọt máu trao đi, một cuộc đời ở lại"" trong tuổi trẻ Quân đội
  Thời gian qua tuổi trẻ Quân đội luôn là lực lượng nòng cốt, xung kích đi đầu, cùng lan tỏa thông điệp “Một giọt máu trao đi, một cuộc đời ở lại.”  
 Hà Nội: Dỡ bỏ tòa nhà ""Hàm cá mập"" trước 30/4/2025
  Tòa nhà ""Hàm cá mập"" trước ngày 30/4 tới; sau khi phá bỏ tòa nhà ""Hàm cá mập"" và kết hợp với tuyến phố xung quanh sẽ tạo ra không gian khoảng 1,2ha để phục vụ cộng đồng.  
 Chi tiết phương án sắp xếp cơ quan trong diện di dời khỏi không gian Hồ Gươm
  Thành phố giao Sở Xây dựng chủ trì phối hợp với Sở Tài chính, cùng ban, ngành có thẩm quyền rà soát các quỹ đất hiện có để bố trí cho các đơn vị thuộc diện di dời để cải tạo Hồ Hoàn Kiếm.   Bạc Liêu: 20 năm tù cho đối tượng mua bán trái phép chất ma túy
  Tòa án Nhân dân tỉnh Bạc Liêu đã xét xử sơ thẩm vụ án hình sự đối với bị cáo Phan Thị Qui, 37 tuổi, ngụ khóm 1, phường Hộ Phòng, thị xã Giá Rai, tỉnh Bạc Liêu về tội “Mua bán trái phép chất ma túy.”   Sơn La: Bắt tạm giam cựu nhân viên ngân hàng lừa đảo chiếm đoạt tài sản
  Năm 2024, lợi dụng danh nghĩa nhân viên một ngân hàng, đối tượng Nguyễn Huy Lâm đã dùng thủ đoạn gian dối để chiếm đoạt 950 triệu đồng tiền giải ngân vay vốn tín dụng.   Tạm giữ đối tượng chống người thi hành công vụ ở Thạch Thất
  Cơ quan Cảnh sát điều tra Công an Thành phố Hà Nội đã ra quyết định tạm giữ người bị giữ trong trường hợp khẩn cấp đối với Nguyễn Xuân Thực về hành vi chống người thi hành công vụ.  
 Người dân Hà Nội xếp hàng để mua 1 chỉ trong ngày vàng đạt mốc 100 triệu đồng
  Dù giá vàng nhẫn đã đạt mức đỉnh cao mới - hơn 100 triệu đồng/lượng nhưng nhiều người dân Hà Nội vẫn xếp rồng rắn xếp hàng chờ mua 1 chỉ vàng.    Nghệ An: Hủy nổ thành công quả bom nặng hơn 300kg còn nguyên kíp nổ
  Quả bom có ký hiệu MK-82, đường kính 20cm, dài 155cm, nặng khoảng 340kg, còn nguyên kíp nổ được người dân phát hiện khi thi công sân bóng đá xã Diễn Lộc, huyện Diễn Châu, tỉnh Nghệ An.   Nam Định nỗ lực xóa toàn bộ nhà tạm, nhà dột nát trong thời gian sớm nhất
  Ngày 19/3, Chủ tịch Ủy ban Nhân dân tỉnh Nam Định Phạm Đình Nghị chủ trì hội nghị Ban Chỉ đạo triển khai xóa nhà tạm, nhà dột nát ở tỉnh.   Bộ Y tế thành lập 6 đoàn kiểm tra phòng chống dịch sởi
  Bộ Y tế thành lập 6 đoàn kiểm tra, giám sát phòng chống dịch sởi và có công văn hỏa tốc đề nghị các tỉnh đảm bảo kinh phí triển khai tiêm chủng vaccine.   Tàu cao tốc Thành phố Hồ Chí Minh đi Côn Đảo có giá vé cao nhất hơn 1,3 triệu đồng
  Theo Công ty TNHH Vận tải hành khách Thành Thành Phát, giá vé cao nhất là giường nằm VIP các ngày cuối tuần với 1,37 triệu đồng/lượt, thấp nhất là vé người khuyết tật 720.000 đồng/lượt ngày thường. 
Đọc nhiều
  
 Toàn cảnh tòa nhà ""Hàm cá mập"" tại quảng trường Đông Kinh Nghĩa Thục sắp phá dỡ
    Quốc hội bầu Phó Chủ tịch Quốc hội, Ủy viên Ủy ban Thường vụ Quốc hội
   
 Con đường xuyên rừng ngập mặn đẹp như tranh vẽ ở Cần Giờ
   
 Phát hiện bức thư “định mệnh” vụ nữ tài xế Mercedes tông 10 xe máy ở Thủ Đức
    Sau 26 năm vắng bóng hổ, Việt Nam có còn “Chúa tể rừng xanh” trong tự nhiên?   
 Infographics

  
 Khuyến cáo của Bộ Y tế phòng chống bệnh sởi
  
 Video

   Hàn-Mỹ tập trận tăng cường khả năng sẵn sàng chung trước các mối đe dọa
    Người dân đi vay tiền để đầu tư vàng, chuyên gia cảnh báo rủi ro cao
  
 Podcast

   Hé lộ nguồn gốc hai chiếc thuyền cổ mới phát hiện ở Bắc Ninh
    Thực hư vụ người đàn ông hất đổ TV khi thấy trăn khổng lồ ""ghé thăm""
    Tổng thống Nga ra điều kiện để đảm bảo tính mạng lính Ukraine xâm nhập Kursk
  Cơ quan chủ quản: THÔNG TẤN XÃ VIỆT NAM Tổng Biên tập: TRẦN TIẾN DUẨN Phó Tổng Biên tập: NGUYỄN THỊ TÁM, NGUYỄN HOÀNG NHẬT, KHÚC THANH THỦY Giấy phép số: 1374/GP-BTTTT do Bộ Thông tin và Truyền thông cấp ngày 11/9/2008. Quảng cáo: Phó TBT Nguyễn Thị Tám: 093.5958688, Email: tamvna@gmail.com Điện thoại: (024) 39411349 - (024) 39411348, Fax: (024) 39411348 Email: vietnamplus2008@gmail.com © Bản quyền thuộc về VietnamPlus, TTXVN. Cấm sao chép dưới mọi hình thức nếu không có sự chấp thuận bằng văn bản."
